film_id,langue_code,resume
25678,fra,"Le soldat Joe Armstrong et le sergent Curtis Jackson débarquent sur l'île de Saint Thomas, dans les Caraïbes. Ils ont pour mission Top Secrète d'enquêter sur plusieurs disparitions mystérieuses de soldats américains... Très rapidement, Joe Armstrong et Curtis Jackson découvrent l'existence d'une base secrète où les militaires disparus sont reconditionnés pour devenir de redoutables guerriers Ninjas. Spécialement entrainés ils sèment la mort partout sur leur passage !"
25682,fra,"Jackson est de retour, et il a maintenant un nouveau partenaire, champion de karaté : Sean. Ils doivent faire face à une organisation terroriste connue sous le nom «Le Cobra», et qui a infecté Sean avec un virus. Sean et Jackson n'ont pas d'autre choix que lutter contre le Cobra et sa bande de ninjas."
25684,fra,"Pour obtenir l'exclusivité mondiale du puissant insecticide mis au point par le professeur Strobel, un magnat de la chimie enlève la fille du scientifique, avec la complicité de mercenaires ninjas. Joe, un Américain ceinture noire, flanqué d'un jeune ninja de 12 ans, part affronter le terrible gang..."
25748,fra,"9 ans après le massacre des adultes de la petite ville de Gatlin, un journaliste vient faire la lumière sur cette affaire, accompagné de son fils..."
25943,fra,"Terry Dean est un voleur professionnel. Après avoir été renversé par une voiture pour sauver la vie d'une petite fille, il est contacté par Dieu qui lui dit qu'il est un ange. Mais, cela s'avère difficile à croire puisqu'il n'a aucun pouvoir particulier."
26127,fra,"Transportant des voitures de sport volées, Wellman Santee est témoin du meurtre d'un policier et de son complice par un lieutenant ripoux : Frank Severance. Blessé et arrêté, Santee s'échappe en prenant en otage Rita Marek, de la police elle aussi. Severance doit absolument l'éliminer. A travers le désert, la chasse à l'homme commence..."
26178,fra,"Un soir, dans une maison isolée au milieu du désert australien, un vieil homme, Jake Cullen, et son petit-fils Scotty sont attaqués par un sanglier monstrueux. L'enfant disparaît et le grand-père, amputé d'une jambe, est un moment accusé du meurtre. Deux ans plus tard, Beth Winters, journaliste américaine, débarque dans la région pour enquêter sur un massacre de kangourous..."
26185,fra,"Le sergent Stan Boyle est abattu lors d'une opération contre un réseau de trafiquants de drogue. Son ami, le sergent Lon McQ, à qui l'on refuse de confier l'enquête, démissionne et se fait embaucher par un de ses camarades qui tient un bureau d'enquêtes. Il s'intéresse tout de suite à un gros bonnet de la drogue, Santiago, et pénètre par effraction dans ses locaux. Il y découvre un important chargement d'héroïne, dérobé dans les bureaux de la police quelques jours plus tôt. Mais Santiago le prend sur le fait et lui apprend que le précieux chargement n'est en réalité composé que de vulgaire sucre. Persuadé qu'un trafiquant se cache au sein de la police, McQ décide de poursuivre ses investigations. Il rend visite à une amie de Stan, qui est assassinée peu après son départ..."
26196,fra,"Cléopâtre « Cleo » Jones est un agent secret spécial travaillant pour le gouvernement des États-Unis. Elle travaille sous couverture comme mannequin afro-américaine. Cleo est une héroïne sous influence « JamesBondienne » crainte et aux multiples talents. Elle possède une Corvette Stingray, année 73, noire et argent. Équipée d'armes automatiques, elle est également experte en arts martiaux."
26263,fra,"Paul Kersey vit désormais avec Karen et la fille de celle-ci, Erica. Mais l’adolescente succombe à une overdose. Paul ne tarde pas à identifier et à abattre le dealer responsable. Il est bientôt contacté par un certain Nathan White, qui a vécu un drame identique au sien et lui propose de mettre fin aux agissements des deux gangs qui contrôlent la marché local de la drogue. Il lui offre de financer entièrement cette croisade et lui remet des dossiers sur les revendeurs et leurs chefs. Paul se met aussitôt au travail…"
26325,fra,"Jane Parker part à la recherche de son père, explorateur en Afrique occidentale, disparu depuis de longues années. Elle le retrouve et se joint à lui lors d'une expédition qui a pour but de découvrir le cimetière des éléphants. Un photographe, Harry Holt, et la compagne de Parker, Africa, participent également aux recherches. Africa est enlevée par une tribu, et Parker soupçonne ce diable de Tarzan, dont il a juré de ramener la tête. Mais Jane rencontre l'homme-singe et s'éprend de lui..."
26337,fra,"L'inspecteur Kyle Bodine est considéré comme le meilleur flic de toute la ville. Mais lorsqu'il devient l'amant de la séduisante Rachel Munro, il ne se doute pas qu'il vient de mettre les pieds dans une incroyable machination qui pourrait lui faire perdre bien plus que son insigne de flic."
26355,fra,Un couple adolescent affronte leur nouveau rôle comme parents après avoir décidé de garder leur bébé.
26444,fra,"En 1930 au Yukon, Albert Johnson, un trappeur, sauve un chien qui a été battu par son maître, Hazel et le soigne chez lui. Hazel porte plainte à la police montée, accusant Johnson d'avoir volé son chien alors que celui-ci a bien été payé. Mais le sergent de la gendarmerie royale, Edgar Millen, ne fait rien. Hazel, accompagné de quelques amis, décide alors de se faire justice et se rend à la cabane de Johnson. Mais le trappeur ne l'entend pas ainsi et en état de légitime défense tue un des compagnons de Hazel. Edgar Millen se voit du coup obligé d'intervenir et accompagné du plaignant, de quelques amis et de son équipe se rend à son tour à la cabane de Johnson..."
26515,fra,"D'après le poème d'Ed Justin, un démon peut se venger à votre place. Alors un homme décide de faire appel à ce démon pour venger son fils tué accidentellement par des jeunes."
26522,fra,"En 1944, le capitaine Davenport est charge d'enqueter sur le meurtre du sergent Waters, un homme de couleur. Mais dans cette caserne ou regne une terrible segregation, il rencontre les pires difficultes pour mener a bien sa mission. Car Davenport est noir. Le trouble sera d'autant plus grand lorsqu'il decouvrira l'etrange personnalite du sergent Waters."
26626,fra,"À deux jours de la fin de ses quatre années d'étude à l'université, Jack est nostalgique et déprimé à l'idée de se séparer de sa bande d'amis. Il se rend compte de la responsabilité que représente leur diplôme. À chacun sa vie désormais."
26672,fra,L'amitié d'un voleur débrouillard et d'un cordonnier désargenté...
26789,fra,"Deux policiers de Chicago, Eddie Juliette et Joe Collins, arretent un petit dealer qui les met sur un gros coup. Un gros bonnet de La Nouvelle-Orleans l'a engage pour executer quelqu'un. Eddie decide de se faire passer pour le tueur et prend contact avec Deneveux, le commanditaire. Mais le reglement de comptes tourne mal et Joe se fait poignarder sous les yeux d'Eddie. Fou de rage, Eddie decide de venger son ami et enleve Michele, la ravissante escorte de Deneuveux. Peu a peu Eddie devient amoureux de sa captive."
26978,fra,"Wolff, un pilote de l'espace, se lance au secours de trois femmes échouées sur Terra 11, une planète ravagée par la peste, et capturée par le tyran local, Overdog. Arrivé sur place, Wolff croise le chemin de Niki, une jeune orpheline..."
27085,fra,"Pendant la première guerre mondiale, un sous-marin embarquant allemands et britanniques se retrouve sur une île inconnue peuplée d'animaux préhistoriques."
27214,fra,"Quelque chose de très étrange se passe dans cette maison et pourtant John Baxter, un journaliste, décide de l'acheter."
27352,fra,"1987. Douze ans ont passé depuis la fin de la guerre du Vietnam. Par le biais du révérend Polanski, le colonel James Braddock apprend que son épouse, qu'il croyait morte lors de la chute de Saïgon, est encore en vie et qu'elle a donné le jour à leur fils, Van Tan Cang, peu après la fin du conflit. Braddock retourne au Vietnam pour les retrouver mais tous trois seront capturés par le général Quoc..."
27381,fra,"Marie, une jeune femme vampire, sévit dans les milieux mafieux où elle apaise ses appétits, tandis que le policier Joe Gennaro, solitaire et désavoué par ses supérieurs, traque le chef de la plus puissante famille de la mafia de Pittsburgh. Marie et Jo sont faits pour se rencontrer."
27418,fra,"Truman Gates, policier de Chicago originaire du Kentucky, traque un membre de la mafia, Isabella, responsable de la mort de son frère Gerald. Aidé par un autre de ses frères puis par toute sa famille qui a quitté leur campagne natale, il parviendra a assouvir son désir de vengeance après avoir démissionné de la police."
27430,fra,"Max et Riton, deux bandits, volent cinquante millions à Orly. Mise au courant Josy, la maîtresse de Riton, avertit son patron, Angelo. Celui-ci enlève Riton et Max se voit obligé de payer la rançon pour le sauver. Mais après le paiement, Angelo tente d'assassiner Max..."
27578,fra,"Ce ne sont ni des mercenaires, ni des agents secrets. Ils choisissent eux‐mêmes leurs missions et n’obéissent à aucun gouvernement. Ils ne le font ni pour l’argent, ni pour la gloire, mais parce qu’ils aident les cas désespérés. Depuis dix ans, Izzy Hands, de la CIA, est sur les traces du chef de ces hommes, Barney Ross. Parce qu’ils ne sont aux ordres de personne, il devient urgent de les empêcher d’agir. Éliminer un général sud‐américain n’est pas le genre de job que Barney Ross accepte, mais lorsqu’il découvre les atrocités commises sur des enfants, il ne peut refuser. Avec son équipe d’experts, Ross débarque sur l’île paradisiaque où sévit le tyran. Lorsque l’embuscade se referme sur eux, il comprend que dans son équipe, il y a un traître. Après avoir échappé de justesse à la mort, ils reviennent aux États‐Unis, où chaque membre de l’équipe est attendu. Il faudra que chacun atteigne les sommets de son art pour en sortir et démasquer celui qui a trahi…"
27591,fra,"Le major Ben McBride met sur place une expédition qui part à la recherche d'un collègue disparu en Arctique. Une fois sur place, l'équipe découvre une oasis tropicale cachée au milieu de la glace ! Très vite, les dangers guettent et une armée d'hommes des cavernes et de dinosaures affamés se lancent en quête de chair fraîche."
27679,fra,"Quand Albert arrive en ville, c'est pour réaliser son rêve: monter sa propre compagnie de taxis. Il engage alors des employés travaillant déjà au service du tyrannique Harold, et essaye de les motiver à faire quelque chose par eux-même. Ce n'est que lorsqu'Albert est kidnappé que les employés vont enfin se serrer les coudes et lutter pour une cause commune."
27738,fra,"En pleine Guerre Froide, un groupe d'amis découvre un jour sur une plage abandonnée de Floride un naufragé russe. Allant à l'encontre de leurs parents et du gouvernement de leur pays, une réelle amitié liera ce groupe de jeunes Américains et le marin."
27769,fra,"Un professeur d’école, accompagné de sa famille, retourne dans sa ville natale trente après que des évènements aient causés la mort de son frère et une bande de jeunes gens.
 Les fantômes de ces enfants reviennent alors harcelé cette famille."
27793,fra,"Alors qu'un gang de jeunes met la main sur le livre magique de L'Histoire sans fin et jette le chaos sur Fantasia, le jeune Bastien est chargé de remettre de l'ordre au pays magique..."
27905,fra,"En 1891, après un naufrage dans la mer des Antilles, Claude le Ross, médecin de bord, arrive sur une ile dirigée par un despote, Edmond Rackham. Claude est charge de maintenir en vie un biologiste prisonnier, afin que Rackham puisse poursuivre sa chasse au trésor."
27958,fra,"La police new-yorkaise enquête sur deux meurtres d'homosexuels appartenant à la tendance sado-masochiste, qu'elle pense être dus au même tueur. Le capitaine David Edelson, chargé de l'affaire, propose à un jeune policier en uniforme, Steve Burns - qui possède les caractéristiques physiques des victimes - d'infiltrer la communauté gay. Comme il ambitionne de devenir ""enquêteur"", Steve, voyant la possibilité d'une rapide promotion, accepte, en dépit du danger qu'il encourt.Installé dans un appartement de Greenwich Village, Steve fréquente toutes les nuits les lieux de rendez-vous homosexuels : bars, discothèques, boîtes de nuit, jardins publics. L'assassin, habillé d'un blouson de cuir à pièces métalliques cliquetantes, porteur d'une casquette de motocycliste et le visage dissimulé derrière des lunettes de soleil, frappe par deux fois encore.."
27983,fra,"Un veuf, père de 8 enfants et une veuve, mère de 10 enfants décident de se marier. Les enfants se querellent et décident de faire divorcer les parents. Ayant réussi et regrettant leurs actes, ils décident de les réunir à nouveau."
28043,fra,"Le film est composé de trois sketches qui, chacun, mettent en scène une situation horrifique.  Le téléphone : Rosy passe une nuit particulièrement éprouvante, harcelée au téléphone par un inconnu lui annonçant sa propre mort...  Les Wurdalaks : un vampire prend les traits d'une femme pour hanter la campagne slave.  La goutte d'eau : Miss Chester n'aurait peut-être pas dû voler la bague de l'une de ses patientes récemment décédée..."
28145,fra,"En pleine dépression économique, les primes des marathons de danse attirent jeunes et vieux accablés par la misère. Robert et sa partenaire Gloria dansent à en perdre la raison. Ils tiendront coûte que coûte. À moins que la mort ne les sépare..."
28176,fra,"En 1948, le jeune ingénieur américain Preston Tucker conçoit une automobile révolutionnaire qu'il baptise de son nom. Le succès prévisible déclenche une contre-attaque immédiate des trois grands constructeurs, General Motors, Chrysler et Ford, pour tuer le projet dans l'œuf. Mais Tucker est décidé à ne pas se laisser faire et à réaliser son rêve : il doit absolument réaliser cinquante exemplaires de sa voiture pour que celle-ci existe de fait."
28190,fra,"En 1833, à l'auberge de Peyrebeille, perdue en montagne, Marie et Pierre Martin, un couple d'aubergistes, assassinent leurs clients pour les voler. Les voyageurs d'une diligence descendent à l'auberge, bientôt suivis par un moine bon vivant. Or, la femme Martin éprouve le besoin de se confesser au saint homme. À sa grande horreur, elle lui avoue la bagatelle de cent trois crimes. Le moine, lié par le secret de la confession, va cependant s'employer par tous les moyens à sauver les voyageurs..."
28313,fra,"Un bébé afro-américain, abandonné par sa mère accroc au crack, est adopté par un couple de blancs. Sept ans plus tard, la mère de l'enfant découvre que son fils est toujours vivant et décide de le récupérer."
28368,fra,"1969 en Virginie. Dans le cimetière d'Arlington, immense ""jardin de pierre"", Jackie Willow est inhumé avec quinze de ses camarades. Le sergent Hazard, présent à la cérémonie, retrace l'histoire personnelle de ce soldat qu'il a jadis chaperonné. Parti pour le Vietnam la tête pleine d'idéaux, le naïf Willow s'aperçoit avec désespoir que cette guerre n'aurait jamais dû avoir lieu."
28370,fra,"Alors qu'il s'apprête à épouser Patty, Jim est enlevé par ses amis masqués lors d'une réception en l'honneur des futurs mariés. Après cette mauvaise blague, Jim est ramené chez lui. À son réveil, il découvre dans sa piscine, stupéfié, un ange d'une beauté divine..."
28569,fra,"En 1929, dans une petite ville du Kansas, Bud, fils d'un riche propriétaire, et Deanie, fille d'un petit actionnaire, s'aiment passionnément et songent à se marier. Mais les préjugés sont trop forts, et leurs parents s'opposent à cette union..."
28597,fra,Junior et Ben emménagent à Mortville. La famille Healys dispose d'une jolie maison et Junior d'une superbe chambre. Ce dernier va faire la connaissance d'une fillette quelque peu exubérante.
28601,fra,"Le petit diable Junior est de retour, plus méchant que jamais ! Dans cette nouvelle aventure, le père de Junior convainc son enfant de se faire des amis en jouant normalement avec eux, et même si cela inclut la danse. Son souhait se réalise quand Junior tombe amoureux de la charmante et populaire Tiffany. Junior va alors se multiplier pour avoir les faveurs de Tiffany et justifier sa terrible réputation..."
28761,fra,"Un réalisateur de films intransigeant, John Wilson, s'apprête à tourner une superproduction en Afrique. Il est peu à peu captivé par un autre projet: celui de partir à la chasse à l'éléphant."
28762,fra,"Après avoir échappé au musée de cire, Mark et Sarah ne sont pas au bout de leur peine. Sarah va se retrouver accusée du meurtre de son beau-père, Mark va trouver un moyen pour essayer d'innocenter son amie à l'aide d'une montre qui lui permet de voyager dans le temps. Ainsi, Mark et Sarah vont se retrouver dans différents univers du monde de la littérature ou du cinéma fantastique."
28794,fra,"Après le suicide de son mentor, le Dr Norman Boyle emménage dans la maison de ce dernier avec sa femme et son fils. Sombrant dans la folie et l´horreur, la famille découvre rapidement que quelque chose se terre dans le sous-sol de la maison."
28881,fra,"Will Parker est désigné pour être le skipper du Radiance, le voilier du syndicat des Defenders pour l'America's Cup. Après le renvoi de l'équipage de sa petite amie Kate et la défaite du Radiance, à la grande honte de l'Amerique et au profit de l'Australien Jack Neville, Will décide de relever à nouveau le défi avec un nouveau yacht."
28893,fra,"Le vaisseau spatial ""Rebus"" s'est posé sur une planète pour une raison inconnue, et tout signe de vie semble y avoir disparu. Apprenant la nouvelle, le Maître semble soulagé, et décide d'envoyer un vaisseau de secours dont il sélectionne lui-même l'équipage. Arrivé sur place, et après un atterrissage mouvementé, l'équipage découvre le vaisseau perdu, et quelques cadavres. Mais plus étrange, une pyramide mystérieuse brouille tous leurs équipements et les empêche de partir..."
29005,fra,"En 1902, John McCabe arrive à Presbyterian Church, une petite ville de l'Ouest américain, pour ouvrir un bordel. Mme Constance Miller, une prostituée, lui propose son aide et son expérience en échange d'une partie des bénéfices. Mc Cabe accepte, mais le succès de l'établissement fait des jaloux..."
29154,fra,"Jaime Escalante est professeur de mathématiques dans une école d'un quartier hispanique. Convaincu que ses élèves ont du potentiel, il adopte des méthodes d'enseignement non conventionnelles pour essayer de transformer les membres des gangs et les non-sceptiques en certains des meilleurs étudiants en algèbre et en calcul."
29161,fra,"Jennifer Corvino se rend en Suisse afin de poursuivre ses études au sein d'un établissement scolaire privé. Élève sérieuse, très douée, elle n'est cependant pas une adolescente comme les autres. Non seulement elle est somnambule mais, plus étrange encore, elle communique par télépathie avec les insectes... Ce don étonnant la place au mauvais moment au mauvais endroit, elle est le témoin involontaire d'un meurtre, et doit maintenant  échapper à la colère du tueur...."
29355,fra,"Molly connait toutes les ficelles du football américain sur le bout des doigts. Elle s'empresse donc de se présenter au poste de coach laissé vacant d'une école, au grand dam de son ex-mari."
29748,fra,Dracula renaît une fois de plus de ses cendres. Grâce à Lord Courtley qui convie trois autres notables londoniens à une messe noire pour ressusciter le vampire. Ces derniers veulent faire marche arrière et assassinent Courtley pendant le rite puis s'enfuient. Dracula revient à la vie et décide de traquer les bourgeois pour venger Lord Courtley.
29778,fra,"Dans un village, une jeune femme est retrouvée morte et portant la marque d'un vampire. L'évêque et le curé monte au château de Dracula, l'un deux fait une chute, et se blesse. Le sang coulant de sa blessure réveille le prince des ténèbres enfoui sous la glace. L'homme de Dieu devient son serviteur et l'aide dans ses terribles méfaits."
29805,fra,"Le paquebot ""Britannic"" transporte 1200 personnes pour une croisière. Un homme téléphone à la compagnie et révèle avoir déposé des explosifs sur le bateau. Une rançon de 500 000 livres doit lui être remise, sinon..."
30163,fra,"Les temps sont durs pour François Pignon qui doit soigner sa fille. Il s'est même résigné à braquer une banque. Il va jusqu'à prendre en otage Jean Lucas, un ancien repris de justice sortant tout juste de prison, pourtant bien décidé à devenir honnête..."
30421,fra,"Ning, jeune collecteur de créances, parcourt pendant deux ans la Chine moyenâgeuse avec son chien Lingot d'or. Il aime Lan, mais celle-ci, lassée de ne pas le voir aussi souvent qu'elle le souhaite, s'est fiancée avec un autre. Ning est désemparé. C'est au cours d'un voyage qu'il rencontre enfin l'amour en la personne de Qian, une femme fantôme qui lui sauve la vie à plusieurs reprises. Perdu dans le monde des morts, Ning apprend à surmonter sa peur pour braver les dangers qui le guettent."
30566,fra,"En 1780, après avoir rendu visite au comte Dracula, Manuwalde, un prince africain, se transforme en vampire et vit enfermé dans un cercueil... En 1972, deux collectionneurs d'antiquités ramènent ce funeste objet à Los Angeles. Blacula se réveille alors et sème la terreur à LA."
30890,fra,"La radio a joué, dans les années trente, un rôle privilégié dans la vie de millions d'Américains. ""Radio Days"" est un hommage à cette ère légendaire. Ses héros sont une famille d'origine modeste dont chaque membre poursuit un rêve distinct, alimenté par l'écoute régulière de la radio."
30943,fra,"Le pire cauchemar de tout parent devient réalité lorsque le fils de trois ans de Beth Cappadora et de son mari Pat disparait au beau milieu du hall d'un hôtel. Neuf ans plus tard, grâce aux efforts d'un policier tenace, Candy Bliss, la famille est enfin réunie. Mais la joie des parents se transforme vite en torture émotionnelle lorsqu'ils se rendent compte que l'adolescent, Vincent, est un jeune homme adopté heureux, sans aucun souvenir de ses parents biologiques. Guère plus que des inconnus, les Cappadora doivent faire face à la réalité et au fait qu'arracher un adolescent de sa famille adoptive et du seul foyer qu'il ait jamais connu ne soit peut-être pas dans son intérêt."
31052,fra,"Après la mort de son fils, Macon Leary, un écrivain de voyage, semble être en train de dormir dans la vie. La femme de Macon semble avoir des problèmes aussi, et pense que ce serait mieux si les deux se séparaient. Après la rupture, Macon rencontre une étrange femme extravertie, qui semble le ramener sur terre. Après avoir commencé une relation avec la femme sortante, la femme de Macon semble penser que leur mariage vaut encore la peine d'être essayé. Macon est alors forcé de prendre de nombreuses décisions"
31121,fra,"Séducteur invétéré, George Roundy entame des relations avec toutes les clientes de son salon de coiffure."
31270,fra,"Un célèbre trafiquant d'armes lègue à sa jeune veuve un château et une importante collection de brevets qui intéresse les services secrets de plusieurs pays. Ainsi quatre barbouzes sont envoyés pour récupérer les précieux documents mais c'est l'agent français Lagneaux qui, recevant l'ordre de séduire la blonde héritière, accomplira sa mission jusqu'au bout."
31283,fra,Hannie décide d'assister Tom Price le chasseur de prime afin qu'il l'entraîne et qu'elle puisse traquer et tuer les 3 hommes qui ont tué son mari et qui l'ont violé…
31357,fra,"L'amitié de quatre femmes qui tentent de surmonter les épreuves de leur vie partagée entre leur mari, leur amant et leur boulot."
31417,fra,"Le professeur Génessier, célèbre chirurgien spécialisé dans les transplantations, est responsable d'un accident de voiture dont sa fille Christiane - qu'il adore - est sortie vivante mais le visage horriblement mutilé. A l'aide d'une assistante dévouée, il attire des jeunes filles dans son pavillon-laboratoire, pour prélever la peau de leur visage et l'appliquer sur les plaies de sa fille. Une opération si difficile que Génessier est obligé de la répéter régulièrement, après chaque échec des greffons. Christiane, un masque sur le visage, ne se doute encore de rien..."
31578,fra,"Trois sketches réalisés par John Carpenter et Tobe Hooper :
 La Station service (The Gas Station) : Une étudiante est embauchée pour travailler de nuit dans une station service tandis qu'un tueur en série sème la terreur en ville.
 Les Cheveux du Docteur Miracle (Hair) : Richard Coberts commence à perdre ses cheveux et cela l'inquiète. Il décide de subir une intervention chirurgicale révolutionnaire afin d'enrayer le phénomène.
 Œil pour œil (Eye) : Brent Matthews, un joueur de baseball professionnel perd un œil suite à un accident de voiture. On lui greffe celui d'un mystérieux donateur. Dès lors il commence à avoir des visions sanglantes."
31583,fra,"Jack Andrews, privé en pleine déprime, est contacté par Fay Forrester, jeune femme gangster, qui vient de se débarrasser de son complice en emportant le magot. Après avoir raconté une histoire à faire pleurer l'homme le plus dur, elle demande à Jack de la faire disparaître…"
31586,fra,Le jeune North est un garçon brillant mais ses parents ne se montrent pas assez attentionnés envers lui. Il décide de trouver d'autres parents.
