film_id,langue_code,resume
5,fra,"Le groom d'un hôtel de luxe présente quatre histoires, se passant dans quatre chambres différentes. The missing ingredient : des sorcières tentent d'invoquer l'esprit de la déesse Diana. The wrong man : un homme armé séquestre sa femme. The misbehavers : un gangster, sa femme et ses deux enfants logent dans une chambre. The man from Hollywood : un acteur arrogant a organisé une fête."
11,fra,"Il y a bien longtemps, dans une galaxie très lointaine... La guerre civile fait rage entre l'Empire galactique et l'Alliance rebelle. Capturée par les troupes de choc de l'Empereur menées par le sombre et impitoyable Dark Vador, la princesse Leia Organa dissimule les plans de l’Étoile Noire, une station spatiale invulnérable, à son droïde R2-D2 avec pour mission de les remettre au Jedi Obi-Wan Kenobi. Accompagné de son fidèle compagnon, le droïde de protocole C-3PO, R2-D2 s'échoue sur la planète Tatooine et termine sa quête chez le jeune Luke Skywalker. Rêvant de devenir pilote mais confiné aux travaux de la ferme, ce dernier se lance à la recherche de ce mystérieux Obi-Wan Kenobi, devenu ermite au cœur des montagnes désertiques de Tatooine..."
13,fra,"Durant trois décennies particulièrement agitées, Forrest Gump vit une série d'aventures le propulsant de l'état de handicapé physique à celui de star du football, de héros du Vietnam au roi de la crevette, des honneurs de la Maison Blanche au bonheur d'une grande histoire d'amour. Forrest est le symbole d'une époque, un candide dans une Amérique qui a perdu son innocence. Son cœur dépasse les limites de son QI…"
18,fra,"New York, XXIIIème siècle. Une boule de feu fonce sur la Terre. Pour l'arrêter il faut retrouver le Cinquième Élément, l'être suprême, qui associé aux quatre éléments vitaux - l'air, l'eau, le feu et la terre - peut seul repousser Le Mal. Cornélius reçoit l'aide de Korben, taxi et ancien agent secret, et de Leeloo, extraterrestre qui a pris la forme d'une jeune femme aux cheveux oranges."
28,fra,"Cloîtré dans une chambre d'hôtel de Saïgon, le jeune capitaine Willard, mal rasé et imbibé d'alcool, est sorti de sa prostration par une convocation de l'état-major américain. Le général Corman lui confie une mission qui doit rester secrète : éliminer le colonel Kurtz, un militaire aux méthodes quelque peu expéditives et qui sévit au-delà de la frontière cambodgienne."
33,fra,"Après avoir été un impitoyable tueur, toujours entre deux verres, Bill Munny a raccroché ses colts pour l'amour d'une femme aujourd’hui disparue. Il élève péniblement des cochons dans un enclos boueux, avec pour seuls compagnons ses deux jeunes enfants. Bill reçoit un jour la visite de Schofield Kid, un apprenti desperado qui veut devenir le partenaire de cette légende vivante. Le Kid lui propose de partager les mille dollars offerts par des prostituées de Big Whiskey, une bourgade lointaine, pour l'élimination des deux cow‐boys qui ont défiguré l'une d’entre elles. Munny finit par accepter la proposition et rend visite à son vieux complice, Ned Logan…"
63,fra,"Nous sommes en l’an 2035. Les quelques milliers d’habitants qui restent sur notre planète sont contraints de vivre sous terre. La surface du globe est devenue inhabitable à la suite d’un virus ayant décimé 99 % de la population. Les survivants mettent tous leurs espoirs dans un voyage à travers le temps pour découvrir les causes de la catastrophe et la prévenir. C’est James Cole, hanté depuis des années par une image incompréhensible, qui est désigné pour cette mission."
75,fra,"Ils arrivent ! D’immondes Martiens, aux yeux globuleux et au crâne énorme, débarquent subitement sur la planète Terre. On ne connaît absolument rien de leurs intentions, mais le président des États‐Unis et ses conseillers se réjouissent unanimement de cette apparition incongrue. Tout comme Art Land, un ambitieux promoteur de Las Vegas, qui voit là la possibilité d’un fructueux coup de publicité, et sa femme, une ancienne alcoolique, fervente adepte du New Age, qui prépare dans la plus pure tradition ésotérique l’union cosmique entre les peuples de toutes les galaxies. Tout un programme ! Mais les affreux jojos venus d’ailleurs sont‐ils aussi cordiaux et désintéressés que tout ce petit monde veut bien le prétendre ?"
78,fra,"2019, Los Angeles. La Terre est surpeuplée et l’humanité est partie coloniser l’espace. Les nouveaux colons sont assistés de Replicants, androïdes que rien ne peut distinguer de l'être humain. Conçus comme de nouveaux esclaves, certains parmi les plus évolués s’affranchissent de leurs chaînes et s’enfuient. Rick Deckard, un ancien Blade Runner, catégorie spéciale de policiers chargés de retirer ces replicants, accepte une nouvelle mission consistant à retrouver quatre de ces individus qui viennent de regagner la Terre après avoir volé une navette spatiale."
79,fra,"Il y a deux mille ans, la Chine était divisée en sept royaumes. Chacun d'eux combattait les autres pour obtenir la suprématie, tandis que le peuple endurait la souffrance et la mort. De ces sept royaumes, Qin était le plus virulent. Le roi de Qin était obsédé par la conquête de la Chine et le désir de devenir son premier Empereur. Les autres royaumes dépêchèrent leurs plus redoutables assassins pour l'éliminer. Le seul nom de trois de ces tueurs suffisait à répandre la terreur : Lame Brisée, Flocon de Neige et Ciel Étoilé. À quiconque anéantirait ces trois assassins, le roi de Qin promit puissance et fortune.  Pendant dix ans, personne n'y parvint. Lorsque le mystérieux Sans Nom se présenta au palais, avec en sa possession les armes des assassins abattus, le roi fut impatient d'entendre son histoire. Assis à dix pas du monarque, Sans Nom commença alors à la raconter…"
85,fra,"1936. Parti à la recherche d’une idole sacrée en pleine jungle péruvienne, l’aventurier Indiana Jones échappe de justesse à une embuscade tendue par son plus coriace adversaire: le Français René Belloq. Revenu à la vie civile à son poste de professeur universitaire d’archéologie, il est mandaté par les services secrets et par son ami Marcus Brody, conservateur du National Museum de Washington, pour mettre la main sur le Médaillon de Râ, en possession de son ancienne amante Marion Ravenwood, désormais tenancière d’un bar au Tibet. Cet artefact égyptien serait en effet un premier pas sur le chemin de l’Arche d’Alliance, celle‐là même où Moïse conserva les Dix Commandements. Une pièce historique aux pouvoir inimaginables dont Hitler cherche à s’emparer."
87,fra,"L’archéologue Indiana Jones est obligé de fuir un cabaret de Shanghai après une négociation houleuse. En compagnie de la chanteuse Willie Scott et du petit Short Round, il se retrouve sur un glacier himalayen, dans un village dont une secte a dérobé le diamant magique et enlevé les enfants afin de les sacrifier."
88,fra,"En 1963. Bébé – de son vrai prénom Frédérique – fille d’une riche famille, passe ses vacances avec ses parents et sa sœur à la pension de la famille Kellerman dans l’État de l’Oregon. Elle va être confrontée à un monde qui lui est complètement étranger, celui de la danse, et vivre une histoire d’amour avec Johnny, l’un des professeurs de danse de l’établissement, issu d’un milieu social très différent. Film à petit budget d’Émile Ardolino, il deviendra l’un des plus grand succès des années 80."
89,fra,"Indiana Jones se lance cette fois‐ci à la recherche du Saint Graal, accompagné de l'éminent et très maladroit Dr Henry Jones, son père. Malheureusement, ils ne sont pas les seuls lancés sur la trace du trésor, les nazis le convoitent également."
90,fra,"Axel Foley, ancien voyou, est maintenant un des flics les plus efficaces de Detroit. Et même si ses méthodes sont loin d'être traditionnelles, ses supérieurs sont bien obligés de reconnaître ses qualités. Axel retrouve un ami d’enfance, mais celui-ci est assassiné le jour de leurs retrouvailles. L'enquête lui étant refusée, Axel prend ses congés et se lance à la poursuite du meurtrier. Le petit flic de Detroit se retrouve à Beverly Hills, entraîné dans le milieu des dealers et des truands…"
96,fra,"Axel Foley est de retour à Beverly Hills. Cette fois, il vient prêter main forte à ses collègues et amis pour résoudre une affaire de vol de bijoux."
97,fra,"Flynn, un concepteur de jeux vidéos qui s'est vu voler ses jeux vidéos par son ex-employeur, veut à tout prix récupérer une preuve qui lui ferait valoir ses droits. Avec l'aide d'Alan et de Lora, deux de ses anciens collègues, il infiltre le MCP (Maître Contrôleur Principal), un ordinateur avide de pouvoir à l'intelligence artificielle surdévelopée. Quand ce dernier découvre que Flynn veut s'infiltrer dans ses circuits, il le téléporte dans un jeu vidéo. Pour s'évader, Flynn devra compter sur l'aide de Tron, un programme indépendant inventé par Alan."
101,fra,Léon est un tueur professionnel redoutable et insaisissable. Il vit seul à New York avec sa plante verte et ses habitudes jusqu'au jour où une petite Mathilda de douze ans sonne à sa porte et fait irruption dans sa vie.
103,fra,"Vétéran de la Guerre du Vietnam, Travis Bickle est chauffeur de taxi dans la ville de New York. Ses rencontres nocturnes et la violence quotidienne dont il est témoin lui font peu à peu perdre la tête. Il se charge bientôt de délivrer une prostituée mineure de ses souteneurs."
104,fra,"Manni est un petit malfrat qui accepte de se mouiller pour un gros coup : en revendant des diamants volés, il obtient cent mille marks, qu'il doit remettre à midi à un trafiquant. Mais il perd le sac contenant l'argent dans le métro berlinois.En dernier recours, il appelle sa copine, Lola, vingt ans, les cheveux rouges, fragile mais déterminée. Manni lui résume la situation. Il est onze heures quarante. Si dans vingt minutes, Manni ne récupère pas l'argent, c'est un homme mort. Désespérée, la jeune femme s'élance dans la capitale. Elle a vingt minutes pour trouver cent mille marks, rejoindre Manni et ainsi sauver l'homme de sa vie..."
105,fra,"En 1985, Marty, un adolescent comme les autres, mène une existence morne et ennuyeuse. Heureusement, il est épris de la jolie Jennifer et entretient une profonde amitié avec Doc, un savant fou qui prétend avoir inventé une machine à explorer le temps. Un jour, Doc invite Marty à l'essayer..."
106,fra,"Le Major Dutch Schaefer et son équipe sont envoyés dans la jungle sud-américaine avec pour mission de délivrer des alliés pris en otage par une bande de guérilleros. Mais pendant l'opération, Dutsch et ses hommes s'aperçoivent que les preneurs d'otages ont été... dépecés et suspendus à la plus haute cime des arbres. Très vite, le commando comprend qu'il a en face de lui un ennemi hors du commun. Un monstre invisible et indestructible venu d'une autre planète. Un extraterrestre rompu à toutes les formes d'attaques et qui ne poursuit qu'un seul but : la chasse à l'être humain. Schaefer et sa troupe sont pour lui du gibier de premier choix."
111,fra,"En 1980, le gouvernement cubain expulse plusieurs centaines de prisonniers dangereux vers la Floride. Parmi eux, Tony Montana : ambitieux et sans scrupules, il élabore un plan pour prendre la place d'un caïd de la drogue."
114,fra,"Quand Edward Lewis, businessman de talent, s’offre les services de la belle Vivian, beauté fatale qui arpente chaque nuit les trottoirs d’Hollywood Boulevard, il décide par amusement de l’engager, de lui faire découvrir son style de vie, de la couvrir de cadeaux. Ils vivent ainsi quelque temps, jusqu’au jour où ils découvrent tous deux qu’ils ne peuvent plus se séparer…"
115,fra,"Jeff Lebowski, prénommé le Duc, est un paresseux qui passe son temps à boire des coups avec son copain Walter et à jouer au bowling, jeu dont il est fanatique. Un jour deux malfrats le passent à tabac. Il semblerait qu’un certain Jackie Treehorn veuille récupérer une somme d’argent que lui doit la femme de Jeff. Seulement Lebowski n’est pas marié. C’est une méprise, le Lebowski recherché est un millionnaire de Pasadena. Le Duc part alors en quête d’un dédommagement auprès de son richissime homonyme…"
117,fra,"À Chicago en 1930, à l’époque de la prohibition, le trafic d’alcool bat son plein et permet à des truands de bâtir des fortunes colossales. Eliot Ness, jeune policier frais émoulu du FBI, est chargé de démanteler un réseau de contrebande d’alcool. L’ennemi est facilement identifiable : Al Capone, inattaquable officiellement, est pourtant impliqué dans les affaires les plus sordides. La première mission de Ness, maladroitement conduite, se solde par un échec humiliant. Loin de se laisser décourager par ce premier affront, Ness décide de s’entourer de personnes de confiance. Il recrute ainsi Jim Malone, un flic qui connaît bien le monde des truands…"
120,fra,"Le jeune et timide Hobbit, Frodon Sacquet, hérite d'un anneau. Bien loin d'être une simple babiole, il s'agit de l'Anneau Unique, un instrument de pouvoir absolu qui permettrait à Sauron, le Seigneur des ténèbres, de régner sur la Terre du Milieu et de réduire en esclavage ses peuples. À moins que Frodon, aidé d'une Compagnie constituée de Hobbits, d'Hommes, d'un Magicien, d'un Nain, et d'un Elfe, ne parvienne à emporter l'Anneau à travers la Terre du Milieu jusqu'à la Crevasse du Destin, lieu où il a été forgé, et à le détruire pour toujours. Un tel périple signifie s'aventurer très loin en Mordor, les terres du Seigneur des ténèbres, où est rassemblée son armée d'Orques maléfiques… La Compagnie doit non seulement combattre les forces extérieures du mal mais aussi les dissensions internes et l'influence corruptrice qu'exerce l'Anneau lui-même."
121,fra,"Après la mort de Boromir et la disparition de Gandalf, la Communauté s'est scindée en trois. Perdus dans les collines d'Emyn Muil, Frodon et Sam découvrent qu'ils sont suivis par Gollum, une créature versatile corrompue par l'Anneau. Celui-ci promet de conduire les Hobbits jusqu'à la Porte Noire du Mordor. À travers la Terre du Milieu, Aragorn, Legolas et Gimli font route vers le Rohan, le royaume assiégé de Theoden. Cet ancien grand roi, manipulé par l'espion de Saroumane, le sinistre Langue de Serpent, est désormais tombé sous la coupe du malfaisant magicien. Eowyn, la nièce du Roi, reconnaît en Aragorn un meneur d'hommes. Entretemps, les Hobbits Merry et Pippin, prisonniers des Uruk-hai, se sont échappés et ont découvert dans la mystérieuse Forêt de Fangorn un allié inattendu : Sylvebarbe, gardien des arbres, représentant d'un ancien peuple végétal dont Saroumane a décimé la forêt…"
122,fra,"Les armées de Sauron ont attaqué Minas Tirith, la capitale de Gondor. Jamais ce royaume autrefois puissant n'a eu autant besoin de son roi. Mais Aragorn trouvera-t-il en lui la volonté d'accomplir sa destinée ? Tandis que Gandalf tente de soutenir les forces brisées de Gondor, Théoden exhorte les guerriers de Rohan à se joindre au combat.  Mais malgré leur courage et leur loyauté, les armées des Hommes ne sont pas de taille à lutter contre les innombrables légions ennemies qui s'abattent sur la Terre du Milieu... Chaque victoire se paye d'immenses sacrifices. Pendant ce temps et malgré ses pertes, la Communauté poursuit sa quête, ses membres faisant tout pour détourner l'attention de Sauron afin de donner à Frodon une chance d'accomplir sa mission. Voyageant à travers les terres ennemies, ce dernier doit s'appuyer sur Sam et Gollum, tandis que l'Anneau continue de le tenter…"
123,fra,"Dans les Terres du Milieu, l'Anneau unique forgé par Sauron le maléfique pour dominer les hommes, les elfes et les nains est tombé par inadvertance dans les mains de Frodon, paisible hobbit. Ce n'est qu'une question de temps avant que les sinistres Cavaliers Noirs, les Servants de l'Anneau, retrouvent sa trace. Sous la direction de Gandalf le magicien, une expédition est alors montée avec pour mission une tâche quasi-impossible : détruire l'Anneau, en le jetant dans le feu de la Montagne du Destin, au coeur du territoire de l'ennemi..."
137,fra,"Phil Connors, présentateur météo grincheux et arrogant, doit tourner un reportage sur la fête de la marmotte. Mais lorsqu'il se réveille le lendemain, il découvre avec stupeur que la date n'a pas changé et qu'il est condamné à revivre un par un les événements de la veille. Connors se voit dès lors obligé de faire face à la répétition infinie du Jour de la marmotte."
146,fra,"Dans la Chine ancienne, Li Mu Bai est un virtuose des arts martiaux. Las des combats, il décide de confier « Destinée », son épée rapide et magique à Yu Shu Lien, à qui il n’ose pas avouer son amour. Celle‐ci doit remettre la fameuse épée au seigneur Té, à la résidence duquel elle fait la connaissance de Jiao Long, la fille du gouverneur Yu, qui a été promise à un homme qu’elle n’aime pas et ferait tout pour mener une vie aussi libre que Shu Lien. Mais une fois la nuit tombée, un habile voleur parvient à la lui dérober. Li et Shu Lien partent récupérer l’épée aux vertus magiques."
150,fra,"Deux meurtriers sont pourchassés par la police, alors qu’ils recherchent le butin d’un casse commis par Reggie Hammond, un de leurs anciens complices actuellement emprisonné. Pour les retrouver, l’inspecteur de police Jack Cates a besoin de l’aide de Reggie. Il va le voir en prison pour solliciter sa collaboration mais Hammond négocie son aide contre une permission de sortie. Jack va donc faire en sorte que Reggie soit en liberté surveillée pendant 48 heures, durant lesquelles il va tenter de l’aider à retrouver ses anciens complices..."
162,fra,"Edward n’est pas un garçon ordinaire. Création d’un inventeur, il a reçu un cœur pour aimer, un cerveau pour comprendre. Mais son concepteur est mort avant d’avoir pu terminer son œuvre et Edward se retrouve avec des lames de métal et des instruments tranchants en guise de doigts."
165,fra,"En 1985, Marty McFly a retrouvé sa famille et sa petite amie après un voyage mouvementé dans le passé. Surgit alors Doc Brown, au volant de sa machine à explorer le temps. Il lui enjoint de le suivre dans le futur, en l'an 2015, pour secourir son fils tombé sous la coupe du sinistre Biff Tannen."
166,fra,"Vic, treize ans, inscrite au lycée Henri-IV, est à l'âge des premières sorties et des premiers émois. Vic n'a guère l'occasion de parler avec ses parents, trop occupés par leur carrière respective, et dont le couple subit les assauts classiques du temps. Elle se confie donc à son arrière-grand-mère, la pétillante Poupette, ou à sa meilleure amie, Pénélope. Elle partagera donc avec elles son amour pour le beau Mathieu. Mais cet amour-là aussi connaîtra quelques difficultés..."
169,fra,"Le lieutenant Mike Harrigan est un flic de Los Angeles. Lorsqu'une fusillade éclate entre des trafiquants de drogue mettant ainsi les rues de la ville à feu et à sang, Mike et son équipe se préparent à intervenir... Mais soudain, les gangsters sont liquidés un par un d'une horrible manière par une créature invisible. Commence alors pour Mike une enquête sanglante qui va le conforter à un monstre extraterrestre qui a pris la ville de Los Angeles pour terrain de chasse !"
170,fra,"Un commando de la Protection Animale fait irruption dans un laboratoire top secret pour délivrer des dizaines de chimpanzés soumis à de terribles expériences. Mais aussitôt libérés, les primates, contaminés par un mystérieux virus et animés d’une rage incontrôlable, bondissent sur leurs « sauveurs » et les massacrent. 28 jours plus tard, le mal s’est répandu à une vitesse fulgurante à travers le pays, la population a été évacuée en masse et Londres n’est plus qu’une ville fantôme. Les rares rescapés se terrent pour échapper aux « Contaminés » assoiffés de violence. C’est dans ce contexte que Jim, un coursier, sort d’un profond coma…"
171,fra,"Deux ans ont passé, Vic, maintenant âgée de 15 ans (et 3 mois) entre en classe de seconde au lycée Henri IV. Ses amis aussi ont grandi. Cela fait maintenant un an qu'elle n'est pas ""sortie"" avec un garçon. Dans le train, en rentrant d'Autriche avec Poupette, lors du contrôle des Douanes, ce n'est pas son passeport qui lui est rendu, mais avec celui d'un Philippe Berthier, un jeune homme de 18 ans dont elle va vite en devenir amoureuse. François et Françoise évoluent dans leurs carrières respectives et des choix devront être faits..."
174,fra,"Alors que Spock, le capitaine Kirk et l'équipage de l'USS Enterprise escortent le chancelier Gordon jusqu'au centre de conférence où il doit signer un accord de paix avec l'Empire klingon, leur vaisseau est attaqué et le chancelier est abattu. Chang, un général Klingon, accuse Kirk, qu'il envoie en compagnie de McCoy sur l'astre de glace Rura Penthe. Spock ne dispose que de quelques jours pour sauver son ami et rétablir la paix menacée."
175,fra,"C'est l'histoire de deux apnéistes, Jacques Mayol et Enzo Molinari. Leur aventure commence dans les îles grecques dès les années 50. Gamins, les deux plongeurs se disputent déjà tous les records des profondeurs. Vingt ans plus tard, ils se retrouvent concurrents au même championnat. «Le grand bleu», c'est l'amitié de ces deux hommes, liés définitivement à la mer."
180,fra,"À Washington, en 2054, la société du futur a éradiqué le meurtre en se dotant du système de prévention / détection / répression le plus sophistiqué du monde. Dissimulés au cœur du Ministère de la Justice, trois extra‐lucides captent les signes précurseurs des violences homicides et en adressent les images à leur contrôleur, John Anderton, le chef de la « Précrime » devenu justicier après la disparition tragique de son fils. Celui‐ci n’a alors plus qu’à lancer son escouade aux trousses du « coupable » … Mais un jour se produit l’impensable : l’ordinateur lui renvoie sa propre image. D’ici 36 heures, Anderton aura assassiné un parfait étranger. Devenu la cible de ses propres troupes, Anderton prend la fuite. Son seul espoir pour déjouer le complot : dénicher sa future victime. Sa seule arme : les visions parcellaires, énigmatiques, de la plus fragile des Pré‐Cogs : Agatha."
192,fra,"En l’an 1327, dans une abbaye bénédictine, des moines disparaissent. Un franciscain, Guillaume de Baskerville, mène l’enquête, aidé du jeune novice Adso von Melk. C’est l’époque où l’Église, en pleine crise, se voit disputer son pouvoir spirituel et temporel. C’est aussi l’apogée de l’Inquisition."
193,fra,"Avec l'aide du capitaine Kirk, présumé mort depuis longtemps, le capitaine Picard doit arrêter un scientifique dérangé prêt à assassiner à l'échelle planétaire pour entrer dans une matrice spatiale."
196,fra,"Ce troisième épisode propulse Marty sur une toute nouvelle mission… en l'an 1885, en plein Far West ! Il n'a que cinq jours pour sauver son ami Doc des griffes du terrible Buford ""Molosse"" Tanner et ainsi lui éviter la mort. Cependant, bon nombre d'embûches vont empêcher nos deux voyageurs de rentrer rapidement vers le futur : ils devront faire face à une panne de la DeLorean, leur très célèbre machine à remonter le temps, affronter une bande de hors-la-loi et croiser sur leur route une maîtresse d'école dont le charme ne laissera pas insensible ce bon vieux Doc…"
197,fra,"À la fin du XIIIème siècle, le roi Edward 1er d'Angleterre s'empare du trône d'Ecosse, réduisant son peuple à la misère. William Wallace donne le signe de la révolte et, à la tête d'une armée de gueux, parvient à reconquérir plusieurs places fortes. Mais les nobles écossais sont lâchés et par deux fois trahissent le héros de leur peuple..."
207,fra,"Todd Anderson est un garçon plutôt timide. Désormais élève de la prestigieuse académie Welton, réputée pour être l'une des plus fermées et austères des États-Unis, tout le monde attend de lui qu'il suive les traces de son frère, qui avait fait à Welton de brillantes études.  C'est là qu'il va faire la rencontre de M. Keating, un professeur de lettres anglaises qui, c'est le moins que l'on puisse dire, sort des sentiers battus. Jour après jour, M. Keating encourage ses élèves à penser par eux-mêmes et à refuser l'ordre établi. Cette rencontre va bouleverser la vie du jeune Todd, mais aussi celle de ses amis."
218,fra,"À Los Angeles en 1984, un Terminator, cyborg surgi du futur, a pour mission d'exécuter Sarah Connor, une jeune femme dont l'enfant à naître doit sauver l'humanité. Kyle Reese, un résistant humain, débarque lui aussi pour combattre le robot, et aider la jeune femme..."
227,fra,"En 1966, dans la petite ville de Tulsa en Oklahoma. Ponyboy, Sodapop et Darrel appartiennent à la bande des Greasers, des jeunes délinquants issus des quartiers défavorisés. Leurs rivaux sont les Socs, des fils de bourgeois. Suite à une bagarre violente, Ponyboy et Johnny tentent d'échapper à la police."
