film_id,langue_code,resume
2625,fra,"Généreux, attachant, plein de charme, Mr. Jones est un homme exceptionnel. Cependant il souffre d'une maladie psychique que les médecins appellent une psychose maniaco-dépressive qui l'entraine parfois à des actes inconsidérés, mettant en danger sa propre sécurité et celle des autres. Apres un excès d'enthousiasme pour Beethoven, il se retrouve a l'hopital psychiatrique où le docteur Elizabeth Bowen le prend en charge. C'est le debut de la guérison et d'une belle histoire d'amour!"
2636,fra,"Désireuse de se venger des assassins de ses parents, tués sous ses yeux alors qu'elle n'était qu'une enfant, la troublante May Munro recourt aux services de Ray Quick, ancien membre des Services spéciaux américains."
2640,fra,"Trois filles de riches chacune prénommée Heather sont les reines du lycée de Westerburg. Elles acceptent néanmoins dans leur clan Veronica, dont elles exploitent la candeur et la naïveté. Celle-ci, sous l'influence de J.D., un autre jeune marginalisé, organise une petite vengeance qui va mal tourner..."
2649,fra,"Nicholas Van Orton, homme d'affaires avisé, reçoit le jour de son anniversaire un étrange cadeau que lui offre son frère Conrad. Il s'agit d'un jeu. Nicholas découvre peu à peu que les enjeux en sont très élevés, bien qu'il ne soit certain ni des règles, ni même de l'objectif réel. Il prend peu à peu conscience qu'il est manipulé jusque dans sa propre maison par des conspirateurs inconnus qui semblent vouloir faire voler sa vie en éclats."
2655,fra,"Le docteur Norman Spencer et sa femme Claire habitent une somptueuse résidence sur les berges d'un lac de la Nouvelle-Angleterre. Tout va pour le mieux mais Claire se sent seule. Sa fille est partie à l'université et son mari consacre tout son temps à ses recherches. Elle entend un jour gémir et pleurer sa nouvelle voisine, Mme Feur, et tente de prendre contact avec elle. Mais elle se heurte à M. Feur, qui lui refuse l'accès a la maison. Au cours de la nuit, elle voit ce dernier charger un grand sac dans sa voiture. Au fil des jours, Claire est assaillie par des sensations étranges."
2666,fra,"Se réveillant sans aucun souvenir dans une chambre d'hôtel impersonnelle, John Murdoch découvre bientôt qu'il est recherché pour une série de meurtres sadiques. Traqué par l'inspecteur Bumstead, il cherche à retrouver la mémoire et ainsi comprendre qui il est. Il s'enfonce dans un labyrinthe mystérieux où il croise des créatures douées de pouvoirs effrayants. Grâce au docteur Schreber, Murdoch réussit à se remémorer certains détails de son passé trouble."
2668,fra,"En 1799, dans une bourgade de la Nouvelle-Angleterre, plusieurs cadavres sont successivement retrouvés décapités. Les têtes ont disparu. Terrifiés, les habitants sont persuadés que ces meurtres sont commis par un étrange et furieux cavalier, dont la rumeur prétend qu'il est lui-même sans tête. Les autorités new-yorkaises envoient alors leur plus fin limier pour éclaircir ce mystère. Ichabod Crane ne croit ni aux légendes, ni aux vengeances post-mortem. Mais, à peine arrivé, il succombe au charme étrange et vénéneux de la belle Katrina Van Tassel."
2669,fra,"Le 23 décembre 1787, le Bounty quitte le Royaume-Uni sous le commandement du capitaine William Bligh et de ses seconds John Fryer et Fletcher Christian, à destination de Tahiti. Malgré plusieurs mises en garde, Bligh insiste pour passer le Cap Horn. Sa tentative est un échec total et il confie alors le poste de premier second à Christian. Arrivés à Tahiti, c'est la joie et la fête, et Christian devient l'amant de la princesse Mauatua, puis l'épouse."
2731,fra,"Saigon, 1930. Eliane Devries dirige une gigantesque plantation d’arbres à caoutchouc. Tout son amour est voué à sa fille adoptive, Camille, jeune princesse vietnamienne. Un bel officier français, Jean-Baptiste Le Guen, va bouleverser leurs vies. Lorsqu’il est exilé dans les îlots lointains, Camille part à sa recherche. Elle découvrira alors son propre pays, fait de passion, de violence et de mort. Une fois réunis, les deux amants embrassent la cause du nationalisme vietnamien…"
2742,fra,"Après avoir développé une dépendance à la substance qu'il utilise pour tuer les insectes, un exterminateur tue accidentellement sa femme et se retrouve impliqué dans un complot gouvernemental secret."
2756,fra,"Un commando de la Marine américaine débarque à bord de la station de forage sous-marine DeepCore afin de porter secours à un sous-marin échoué dans les profondeurs. L'équipe de Bud Brigman accueille ces nouveaux arrivants, ainsi que Lindsey, future ex-femme de Bud. Alors que les travaux de récupération commencent autour du submersible naufragé, l'équipage de DeepCore doit faire face à des phénomènes inexpliqués. Et s'ils n'étaient pas seuls dans les abysses ?"
2758,fra,"Chose curieuse mais point trop inhabituelle au sein de la famille Addams : Morticia accouche aussi brusquement d’un bambin qu’elle s’est trouvée enceinte. L’heureux nouveau‐né porte la moustache et répond au doux nom de Puberté. Mercredi et Pugsley, ses deux aînés, fous de jalousie, multiplient les tentatives d’assassinat. Inquiets, les parents embauchent Debbie, une nurse venue du pays de la lumière – mais qui nourrit de noirs desseins – et expédient les deux monstres dans une colonie de vacances affreusement ensoleillée. Pendant ce temps, la baby‐sitter tente de se faire épouser par Fétide, le frère solitaire de Gomez, afin de mieux le trucider ensuite…"
2768,fra,"Julian Kay, trente ans, vit à Los Angeles. Beau, libre et indépendant, il monnaie ses charmes auprès de dames riches et esseulées. Il accepte un jour de se rendre à Palm Springs, auprès de la femme d'un financier sadique et voyeur. Le lendemain, sa cliente est retrouvée morte. Julian est immédiatement soupçonné par la police, qui confie l'enquête à l'inspecteur Sunday. Tout indique qu'il s'agit d'un coup monté, bien sûr, mais comment le prouver ? Quelque temps auparavant, dans un bar, Julian a rencontré Michelle, la femme d'un politicien influent. Ils se sont revus depuis, et Julian est finalement tombé amoureux de la jeune femme..."
2788,fra,"Leilana Pierce vient d'obtenir son diplôme de fin d'études, à Houston, en 1994. Intelligente, active autant que ravissante, elle ambitionne de conquérir le monde mais doit vite déchanter. Si elle ne trouve qu'un emploi d'assistante de production, peu en rapport avec ses compétences, ses amis, quant à eux, végètent dans des petits boulots. Tous les soirs, la bande se retrouve dans l'appartement de Leilana. Il y a là sa colocataire, Vickie, Troy, un musicien instable et écorché vif, et Sammy, un célibataire endurci. Lors de discussions sans fin, ils reconstruisent un monde qui se refuse à eux..."
2898,fra,"Melvin Udall, un écrivain misanthrope, écrit à la chaîne des romans sentimentaux qui comblent son sens pervers de l'autodérision et lui permettent de vivre confortablement. Sa vie est réglée comme du papier à musique, il évite le contact humain hormis celui de Carol Connelly, une jeune mère célibataire, serveuse dans un restaurant où il prend ses repas. Un jour, Simon Bishop, son voisin, artiste gay, est défiguré par deux voyous, le fils de Carol tombe malade et Melvin hérite du chien de Simon pendant son séjour à l'hôpital. Sa vie en est toute bouleversée."
2907,fra,"Rififi chez les Addams, célèbre famille macabre qui vit dans un manoir hanté, lorsque débarque l'oncle Fétide, sosie d'un des membres de la famille disparu vingt-cinq ans plus tôt… Ne serait-il pas un usurpateur qui cherche à les doubler pour faire main basse sur leur trésor caché ?"
2912,fra,"Dans un village du Périgord, la vie quotidienne des habitants cesse brusquement d'être tranquille. Des femmes sont égorgées. Par qui ? Le boucher, qui a fait les guerres d'Indochine et d'Algérie, semble devenir le suspect numéro un aux yeux de la directrice d'école, qui ressentait pour lui de tendres sentiments."
2924,fra,"Deux frères, Stephen et Brian McCaffrey, se destinent au métier de pompiers après avoir assisté à la mort tragique de leur père, officier d'élite de la 17e caserne des sapeurs-pompiers de Chicago. Vingt ans plus tard, si Stephen est devenu un pompier émérite, Brian vit de petits boulots. De retour à Chicago, il décide néanmoins de reprendre son entrainement sous l’œil sceptique de son frère.Mais celui-ci doit également se concentrer sur une nouvelle vague d'incidents criminels qui frappent la ville : des flammes éclairs, des backdraft, ces incendies qui s'éteignent d'eux-mêmes dans le propre souffle de leur explosion, terrassent un à un d'anciens collaborateurs du maire..."
2926,fra,D'Artagnan se lie d'amitié avec trois mousquetaires du roi Louis XIII. La reine Anne d'Autriche leur confie la mission de lui rapporter de Londres des ferrets qu'elle a imprudemment offerts au duc de Buckingham.
2978,fra,"Croyant avoir réussi l'extermination totale de tous les revenants de New York, l'équipe de "" SOS Fantômes "" reprend du service quand la belle Dana leur confie que son bébé, Oscar, subit des phénomènes paranormaux. Peter Venkman, devenu animateur d'une émission télé sur le monde psychique, et ses acolytes Ray, Egon et Winston, découvrent en sous-sol, une rivière gluante de plasma rose émettant des énergies particulièrement négatives…"
2984,fra,"Ogden Mears est un ambassadeur américain qui découvre, cachée dans sa cabine de bateau, une comtesse russe. Elle veut aller aux États-Unis. Mears va tomber amoureux, mais sa femme l'attend à Hawaï."
2990,fra,"Inspiré d'un fait réel, le film raconte l'histoire de Patty et Drake qui viennent d'acheter la maison de leurs rêves à San Francisco. Pour les aider financièrement, ils décident de louer la chambre du rez-de-chaussée et choisisent un dénommé Carter Hayes qui semble être le locataire idéal. Mais dès son emménagement, les choses tournent mal..."
3036,fra,Le jeune savant Victor Frankenstein est persuadé que la science peut venir à bout de tout et même créer la vie. Il s'attèle à cette tache avec ardeur et crée à partir de morceaux de cadavres un être humain qui sera acculé par sa différence à la méchanceté.
3049,fra,"Ace Ventura, un jeune homme décontracté à la banane arrogante et à la démarche élastique, est le Sherlock Holmes de la gent animale. Le voici à nouveau sur les dents quand le dauphin nommé Flocon de neige, mascotte de l'équipe de football américain de Miami, manque à l'appel."
3053,fra,"Un vieux savant et son aide pourchassent, dans un sinistre château de Transylvanie, une curieuse espèce de vampires."
3054,fra,L’agent de contre-espionnage américain Matt Helm est chargé par le gouvernement d’appréhender le comte Contini qui a provoqué une crise financière mondiale en dérobant de l'or pour une valeur équivalant à 1 milliard de dollars. On adjoint à Matt l’agente britannique Freya Carlson qui va créer plus de problèmes qu’elle ne va en résoudre…
3055,fra,"Anne Welles quitte sa famille et son fiancé pour découvrir New‑York. Elle fait la connaissance de deux autres jeunes femmes qui prévoient de faire carrière dans le monde du spectacle : l'ambitieuse et prometteuse Neelly O'Hara et la très belle mais peu talentueuse Jennifer North. Très vite, elle s'aperçoit que le milieu est impitoyable."
3101,fra,"Joey et Rosalie Boca, gérants d'une pizzeria, forment un couple apparemment heureux et uni. Mais Joey est un dragueur invétéré. Rosalie ne se rend compte de rien jusqu'au jour où elle prend son mari en flagrant délit de séduction dans une bibliothèque."
3116,fra,"Joe Buck, blond et beau gosse, quitte sa petite bourgade du Texas pour monter à New York, où il espère se faire entretenir par des femmes riches. Mais la dureté de la ville lui fait rapidement perdre ses illusions. Seul, sans un sou, il fait la connaissance de Ratso Rizzo, un petit Italien chétif, boiteux et tuberculeux. Parce que ce dernier a l'air encore plus seul que lui, Joe accepte de partager son appartement miteux. À l'opposé l'un de l'autre, ils partagent pourtant la même misère dans les bas-fonds new-yorkais, s'accrochant au même rêve : partir vivre sous le soleil de Floride..."
3176,fra,"Dans un avenir proche, les élèves de la classe B de 3ème du collège Shiroiwa ont été amenés sur une île déserte par une armée mystérieuse. Un adulte surgit tout à coup devant eux : leur ancien professeur Kitano. Il leur annonce qu'ils vont participer à un jeu de massacre dont la règle consiste à s'entretuer. Seul le dernier des survivants pourra regagner son foyer. Kitano leur présente deux nouveaux élèves très inquiétants. Des coups de feu retentissent pour convaincre les incrédules. Selon la loi de réforme de l'éducation pour le nouveau siècle, ce sacrifice permettra de former des adultes sains. Abandonnés chacun à son sort avec de la nourriture et une arme, les adolescents disposent d'un délai de trois jours pour s'entretuer."
3480,fra,"L'action se déroule en 1944, à Montauban. Le chirurgien Julien Dandieu y mène une vie paisible avec sa femme, Clara, et leur fille Florence. Cependant, l'invasion allemande ne peut le laisser indifférent : préférant les savoir éloignées des tourments de cette guerre, Julien demande à son ami François de conduire Clara et Florence à la campagne, où cette famille possède un château, véritable forteresse médiévale qui surplombe un village. Une semaine plus tard, ne supportant plus l'absence des siens, Julien rejoint sa famille pour découvrir, avec effroi, que les Allemands ont déjà semé la terreur dans le village."
3512,fra,"Le Grand Continental et ses passagers sont les otages d’un ingénieur surdoué et dangereux, Travis Dane. Son but : obtenir du gouvernement une rançon d’un milliard de dollars. Sinon, grâce à un satellite placé sous son contrôle, il rayera Washington de la carte ! Son plan est parfait à un détail près: l’un des passagers du train est un ancien marine, ex-cuisinier à bord de L’USS Missouri: Casey Ryback."
3525,fra,"Les aventures de Tess, jolie et intelligente employée de bureau, dans la jungle de Wall Street. Manipulée par des supérieurs machistes et Katherine, plus élégante qu'elle et au vernis culturel plus évident, elle parviendra néanmoins à tirer son épingle du jeu en abattant un à un les obstacles et en faisant preuve d'audace."
3536,fra,"En 1942, les États-Unis viennent d'entrer en guerre contre les forces de l'Axe. Le capitaine Mike Dahlgren commande le S-33, un sous-marin archaïque mais redoutable. À son bord se trouvent les lieutenants Andrew Tyler et Emmett, l'enseigne de vaisseau Klough, Wassner et d'autres hommes d'équipage, engagés dans une mission décisive. Le S-33 va être maquillé en sous-marin allemand, l'un des célèbres U-Boot qui patrouillent au fond de l'océan. La réussite de leur mission va dépendre désormais de leur solidarité, de leur rapidité et de leur courage."
3580,fra,"Los Angeles, 1928. Un matin, Christine dit au revoir à son fils Walter et part au travail. Quand elle rentre à la maison, celui-ci a disparu. Une recherche effrénée s'ensuit et, quelques mois plus tard, un garçon de neuf ans affirmant être Walter lui est restitué. Christine le ramène chez elle mais au fond d'elle, elle sait qu'il n'est pas son fils..."
3586,fra,"Paris, mars 1994. Chronique de la semaine du prêt-à-porter et du grand et petit monde qui gravite autour, le tout ponctué par un étrange décès."
3591,fra,"L'homme préhistorique Tumak est banni de sa tribu. Sur sa route, il rencontre la belle Loana, qui décide de quitter elle aussi son clan pour l'accompagner sur sa route."
3604,fra,"Le footballeur Flash Gordon et ses amis, le docteur Zarkov et Dale Arden, sont fait prisonniers par Ming, empereur de la galaxie Mongo. Ils trouvent une alliée, la fille de Ming, qui va les sauver d’une mort certaine. Celle‐ci a en tête bien d’autres projets pour Flash Gordon."
3870,fra,"Parabole sur l'itinéraire de deux enfants qui naissent en 1900 dans un village d’Émilie. L'un, Olmo Dalco, appartient au milieu des métayers, l'autre, Alfredo Berlinghieri, est le fils du propriétaire."
3934,fra,"Antoine est amoureux de la froide Monique qui le rabroue en permanence. Alors Antoine confie son désespoir à son copain Bob qui l'écoute avec beaucoup d'intéret, car il est amoureux d'Antoine. C'est ainsi que débute cette histoire d'amour..."
3980,fra,"Les krits, aliens en forme de boules de poils, aux dents acérées et criminels intergalactiques, réussissent à s'évader de leur prison de l'espace à bord d'un vaisseau spatial. A leurs trousses, deux chasseurs de prime extra-terrestres qui ont la faculté de changer de visage. Tout ce petit monde atterrit dans le Kansas, non loin de la ferme de la famille Brow. Leur première victime : une vache. Mais peu à peu, ils vont prendre goût à la chair humaine."
4011,fra,"Adam et Barbara Maitland, un couple de jeune mariés heureux, meurent stupidement d’un accident de la route en ayant voulu éviter un chien. Ils deviennent alors des fantômes incapables de sortir de leur maison, alors que de nouveaux et insupportables propriétaires, les Deetz, s’y installent. Devant leurs efforts infructueux pour chasser ces derniers, ils font appel à Beetlejuice, un «bio-exorciste» fantôme, excentrique et imprévisible..."
4032,fra,"Vada Sultenfuss pourrait être une petite fille brillante et dynamique de 11 ans, mais avec sa mère morte en couches et son père Harry entrepreneur de pompes funèbres que plus rien n'intéresse depuis, Vania est complètement obsedée par la mort. Et l'arrivée de Shelly, une esthéticienne pour cadavres, dont Harry va peu à peu tomber amoureux, ne lui plaît pas d'avantage..."
4034,fra,"Le deuxième classe Adrien Dufourquet est témoin de l'enlèvement de sa fiancée Agnès, fille d'un célèbre ethnologue. Il part à sa recherche, qui le mène au Brésil, et met au jour un trafic de statuettes indiennes."
4043,fra,"Une réflexion sur le désir à travers les amours compliquées d'un metteur en scene et de sa soeur qui, il y a vingt ans, était un homme."
4104,fra,"Depuis que leurs parents sont morts, Benny s'occupe de sa sœur Joon, mentalement déficiente. Mécanicien, il ne roule pas sur l'or mais fait tout ce qu'il peut pour aider Joon, sans aide extérieure. Tout bascule le jour où Sam, un romantique quasi analphabète, débarque dans leurs vies. Entre Sam et Joon, le courant passe tout de suite. Benny en profite pour s'accorder un peu de temps libre. Mais il découvre bientôt que sa sœur vit une véritable passion !"
4105,fra,"Un policier new-yorkais est chargé d'escorter à Osaka un criminel japonais. Rapidement, ce dernier s'échappe. Le représentant de l'ordre va alors avoir beaucoup de mal à le retrouver dans un pays dont il ignore les us et coutumes."
4180,fra,"« Un copain déposera un colis et passera le reprendre plus tard », tel est le message laissé par Jacques, avant son départ pour le Japon, à ses deux compères Pierre et Michel avec lesquels il partage un luxueux appartement. Comme prévu, le colis arrive et à la stupéfaction générale, il s'agit d'un bébé… Adieu liberté et aventures sans lendemain."
4192,fra,"Linnet Ridgeway, belle enfant gâtée, a épousé Simon Doyle, le fiancé de Jacqueline, sa meilleure amie. Le couple effectue son voyage de noces en Égypte à bord du « Karnak ». Une galerie de personnages inquiétants assombrit l'atmosphère. Il y a là Jacqueline, qui suit le jeune couple à la trace, une romancière nymphomane, madame Otterbourne, un jeune communiste particulièrement méprisant, une vieille dame envieuse et un charlatan. Lorsque Linnet décide de fuir cette atmosphère oppressante, il est déjà trop tard : elle est abattue d'un coup de feu. D'autres crimes vont succéder à ce meurtre. Par chance, Hercule Poirot fait également partie de la croisière. Le célèbre détective belge se lance alors dans une minutieuse enquête, tout en subtilité, pour démasquer le meurtrier..."
4193,fra,"Sur le point d’épouser la belle Arlena, une actrice, Horace Blatt lui a fait présent d’un bijou de grande valeur. Mais, la fiancée a rompu sa promesse et rendu le cadeau. Peu après, Blatt découvre qu’il n’a plus qu’un faux en sa possession. Hercule Poirot accepte de récupérer le vrai bijou. Il se rend donc sur la petite île de l’Adriatique où Arlena, devenue entre‐temps madame Marshall, doit bientôt séjourner. Il découvre dans son hôtel toute une collection de personnages plus ou moins insignifiants qui se connaissent et qui ont tous une bonne raison d’en vouloir mortellement à Arlena. Celle‐ci ne tarde pas, d’ailleurs, à être assassinée…"
4202,fra,"Inquiet de la nouvelle orientation imprimée à la révolution en 1793, Danton quitte sa retraite et regagne Paris. Il dénonce la ""Terreur"" qui règne sur la capitale et affronte son ancien compagnon de lutte, Robespierre."
4203,fra,"Ivan et Pepa, deux comédiens de doublage, prêtent leur voix aux grandes stars du cinéma et se jurent chaque matin dans la pénombre du studio un amour éternel. Mais Ivan abandonne subitement Pepa. Celle-ci va mener son enquête et découvrir la double vie de l'homme qu'elle aime."
4228,fra,"L'histoire de la Révolution française en deux parties : la première « Les Années lumières » relate les évènements de 1789 jusqu'à l'assaut des Tuileries le 10 août 1792, quand le roi Louis XVI est jeté en prison, la seconde « Les Années terribles » nous emmène jusqu'à la fin de la Terreur en 1794 avec l'exécution de Robespierre."
4235,fra,"Le tueur Roger Sartet s'évade du fourgon cellulaire qui le transportait. C'est le clan des Siciliens dirigé par Vittorio Manalese qui a mis au point cette évasion. Sartet confie au clan un projet dont l'idée lui est venue en prison: s'emparer de la collection de bijoux d'une exposition. Manalese fait alors venir son ami Tony Nicosia, un «professionnel» et Sartet prend l'identité d'un diamantaire chargé du convoi des bijoux. L'avion est détourné en vol mais Sartet, qui a eu une brève liaison avec Jeanne, la belle-fille de Manalese, est dénoncé à ce dernier. Manalese fait revenir Sartet à Paris et le tue. Peu de temps après, le clan des Siciliens est arrêté par la police."
4271,fra,"Dans une petite ville du nord de la France, deux familles nombreuses, les Le Quesnoy et les Groseille, d'origines bien différentes, n'auraient jamais du se rencontrer. Mais c'était sans compter sur Josette, l'infirmière devouée du docteur Mavial, amoureuse et lasse d'attendre qu'il quitte sa femme. Dans un moment d'égarement la douce infirmière a échangé deux nouveau-nés, un Groseille (les pauvres) contre un Le Quesnoy (les riches), pour se venger de la vie et du docteur. Comprenant que Mavial ne l'épousera jamais, elle révèle le-pot-aux roses aux deux familles..."
4274,fra,"Peu avant la Première Guerre mondiale, un officier d'origine paysanne combat efficacement les tribus révoltées du Sahara. Malgré ses qualités de courage et d'abnégation, il est considéré comme un parvenu par la « bonne société » qui le méprise et le rejette. De retour a Paris, il vit une folle passion amoureuse. Cependant, déçu par la politique, il retourne dans le désert."
4327,fra,"Eric Knox a conçu un logiciel révolutionnaire qui, s’il tombait en de mauvaises mains, mettrait en danger la vie privée de tous ceux qui approchent un ordinateur. Lorsqu’il est enlevé, la présidente de Knox Technologies fait appel à Charlie et à ses trois jeunes détectives aussi sexy qu’intelligentes. Natalie, Dylan et Alex s’intéressent d’abord à Roger Corwin, rival de Knox et propriétaire du plus grand réseau de télécommunications par satellite du monde. Pour infiltrer le cercle de ses proches, les trois jeunes femmes ne reculent devant rien."
4437,fra,"Pendant que la Terre est en proie à la menace nucléaire, un équipage de Russes et d’Américains tente de retrouver l’astronef de 2001 et le secret de HAL, l’ordinateur homicide... L’événement majeur qu’a constitué la sortie de 2001 L’Odyssée de l’Espace avec la musique majestueuse de Strauss ""Ainsi parlait Zarathoustra"" se poursuit avec 2010."
4476,fra,"Dans le Montana des années 1914-1918, l'histoire d'Alfred, Tristan et Samuel, trois frères, qui ont été élevés par leur père William Ludlow, colonel en retraite. Le temps passe et Samuel le cadet des frères se fiance et présente l'élue de son cœur, Susannah, à toute la famille. Ses frères tombent immédiatement sous le charme de la demoiselle. Puis quand la première guerre mondiale éclate, les trois frères partent. Samuel n'en reviendra pas. Sa disparition provoque l'effondrement de la famille et le réveil de douleurs refoulées."
4477,fra,"Un jeune militant irlandais réfugié aux États-Unis est chargé de récupérer en contrebande pour l'IRA une importante cargaison de missiles. Pour mener à bien sa mission, il prend une nouvelle identité et trouve refuge dans la famille d'un policier new-yorkais d'origine irlandaise qui ignore tout de ses activités. Une véritable affection nait entre les deux hommes. Mais bientôt le policier se doute du rôle de son hôte."
