film_id,langue_code,resume
10608,fra,"L'épopée satirique de la campagne éléctorale d'un chanteur de musique folk, Bob Roberts, qui se porte, en 1990, candidat au Sénat americain."
10617,fra,"A la fin du XIXe siècle à Fa Shan, en Chine du Sud. Tandis que les puissances coloniales européennes et américaines s'y affrontent pour le contrôle du commerce maritime, les premiers signes d'occidentalisation commencent à percer dans la société chinoise. Dans ce climat politique tendu, Wong Fei-hung, docteur en médecine chinoise, maître de kung-fu et chef instructeur de l'armée du Dragon noir, est chargé par le commandant Lau de maintenir l'ordre durant les guerres qui éloignent ses troupes de la région, afin de sauvegarder ce qui reste de paix et de stabilité."
10618,fra,"Dans la Chine de 1895, les Européens pratiquent une politique impérialiste qui leur vaut le ressentiment de la population. En réaction, une société secrète, la secte du lotus blanc, attaque régulièrement les Britanniques. Au point que ceux-ci envisagent de dépêcher leur armée... Devant ce risque, Wong Fei-hung, combattant sans pareil, met toute sa science des arts martiaux en œuvre pour les protéger."
10619,fra,"L'impératrice décide dans le plus grand secret d'instaurer la compétition de la Tête de Lion, qui doit distinguer les plus grandes écoles de kung-fu de Chine."
10620,fra,"Wong Fei-hung, tante Yee et Yen (Pied-bot) vont en Amérique."
10640,fra,"En 1985, Chuck Browning (Peter Fonda) voit un certain Frenchy LaPorte (Ed Geldart), qui l'avait contacté, mourir devant lui en prononçant le mot ""DELOS"". Le reporter avait couvert deux ans plus tôt le massacre des touristes par les robots dans ce centre de loisirs futuriste. Ayant rouvert le centre, modernisé et agrandi, le docteur Duffy (Arthur Hill) invite Browning et sa collègue Tracy Ballard (Blythe Danner) pour juger impartialement."
10648,fra,"De nombreux assassinats sont commis à San Francisco. Les victimes : des proxénètes, des trafiquants de drogue ou des criminels. L'inspecteur Harry est chargé de l'affaire. Son supérieur Briggs le déteste. Harry va bientôt découvrir pourquoi."
10651,fra,"L'inspecteur Harry Callahan continue son chemin pour faire régner l'ordre et la justice. A présent, les médias s'intéressent à lui, après l'avoir dédaigné pendant très longtemps. Au même moment, de terribles meurtres ont lieu dans le milieu des films pornographiques, et une étrange liste survient où sont annoncés les noms des futures cibles. L'inspecteur Harry y figure aussi..."
10655,fra,"En 1863, les forces sudistes et nordistes vont s'affronter à Gettysburg lors d'une bataille décisive de la Guerre de Secession."
10656,fra,"Après avoir dérobé des documents compromettants, un homme se réfugie dans l'univers souterrain et agité du métro parisien. Une impitoyable chasse à l'homme s'organise au cours de laquelle d'étranges liens se tissent entre le cambrioleur et sa victime."
10658,fra,"Howard est un canard qui vit en paix sur sa planète. Jusqu'au soir où une mystérieuse tornade l'arrache à son fauteuil. Le palmipède se retrouve projeté dans l'espace intersidéral et finit par atterrir dans l'arrière-salle d'un bar punk, à Cleveland, dans l'Ohio. Une jeune chanteuse de rock, Beverly Switzler, s'y produit. À la fin de son numéro et alors qu'elle s'apprête à regagner ses pénates, deux loubards l'agressent. Howard vole à son secours. Reconnaissante, Beverly accueille ce courageux canard sous son toit. Sa nouvelle vie ne déplaît pas à l'animal, que son sens de la répartie cinglante protège des sarcasmes des Terriens. L'un d'entre eux pourtant ne songe pas à se moquer de lui : Phil, un ami de Beverly qui travaille au muséum d'histoire naturelle, s'intéresse même de très près à son cas..."
10660,fra,"New York. Charlie Lang n'a d'autre ambition dans la vie que d'être un bon flic et un chic type. Muriel, son épouse, est coiffeuse. Lasse de son existence étriquée, elle entretient des rêves de réussite sociale en jouant à la loterie. Un jour, dans une cafétéria, Charlie fait la connaissance d'une jolie serveuse, Yvonne, acculée à la ruine par les frasques de son mari. À court de monnaie, il lui propose en guise de pourboire de partager ses gains à la loterie si ses numéros sortent. Quand il apprend qu'il vient de gagner 4 millions de dollars, il entend tenir sa promesse. Mais c'est compter sans Muriel."
10673,fra,"Bud Fox est courtier dans une banque d’affaire de Wall Street. Il est ambitieux, un jeune loup aux dents longue qui ne rêve que d’avoir comme client Gordon Gekko, l’un des hommes les plus puissants du monde de la finance. Pour séduire Gekko, Fox lui livre des secrets fournis par son père. Dès lors Gekko le prend sous son aile et l’affranchit aux secrets de la finance de haute volée. Pour Fox, une nouvelle vie commence faite de luxe, d’argent, de filles faciles et d’appartements de grand standing. Mais aussi de corruption, de détournements, de mensonges et de trahisons. Et dans ce monde en guerre, Bud Fox pourrait perdre bien plus que son âme."
10675,fra,"Richard Walker, cardiologue américain, arrive à Paris en compagnie de sa femme Sondra pour assister à un congrès médical. Quelques heures après leur arrivée Sondra disparaît mystérieusement. Richard part à sa recherche dans un Paris qu’il ne connait pas."
10692,fra,"Henry, portrait d'un serial killer est un film basé sur la vie et les 'exploits' macabres de l'un des tueurs en série les plus monstrueux de toute l'histoire des Etats Unis: Henry Lee Lucas. Comme tous les serial killers Harry possède un double visage, celui d'un homme ordinaire sans histoire, et un autre qui l'entraine dans une folie meurtrière sans précédent en compagnie de son ami et 'collègue' Otis Toole."
10699,fra,"Bernie LaPlante, éternel looser, considéré comme un tocard par son entourage, sauve, une nuit où il erre aux abords de Chicago, les passagers d'un avion, qui vient de s'écraser sous ses yeux. Quand Gale Gayley, jeune reporter TV, qui se trouve parmi les victimes, veut le remercier, Bernie a disparu, laissant derrière lui un indice, une chaussure embourbée. La jeune femme bat la campagne pour retrouver le propriétaire de la chaussure et c'est un clochard, John Bubber, auquel Bernie avait confié son aventure, qui se présente à l'Amerique reconnaissante."
10708,fra,"Deux pères qui ont perdu leur emploi se trouvent dans l'obligation de retirer leurs fils du très prisé centre d'apprentissage de Miss Harridan pour s'occuper d'eux. Ils ne parviennent pas à retrouver du travail et décident de créer leur propre garderie pour enfants. Leur crèche, gérée selon des méthodes peu conventionnelles, remporte un succès immédiat et va jusqu'à concurrencer l'établissement dirigé par Miss Harridan qui à jusqu'à présent envoyé tous ses adversaires au tapis."
10714,fra,"Élevé par des animaux sauvages depuis son enfance, Mowgli est attiré hors de la jungle par la belle Kitty. Mais Mowgli doit finalement affronter le capitaine corrompu Boone, qui veut à la fois la main de Kitty et les trésors de Monkey City - un endroit que seul Mowgli peut trouver."
10722,fra,"Le prêtre Ángel Beriartúa a décodé les Évangiles et est parvenu à déterminer le jour de la naissance de l'Antéchrist. Selon ce message, l'Antéchrist naîtra le 25 décembre 1995 à Madrid, où débute une vague de vandalisme et de criminalité. En revanche, il ignore tout du lieu où il viendra au monde. Convaincu qu'il faut arrêter cette naissance satanique, le prêtre se joint à un fan de death metal, José Maria (Santiago Segura), d'essayer par tous les moyens à trouver où l'événement aura lieu. Il va donc tout mettre en œuvre pour le découvrir, en cherchant à s'attirer les faveurs du Diable. Dans un Madrid survolté, il va trouver deux compagnons pour l'aider dans sa tâche : le hard rockeur José María et le professeur Cavan."
10724,fra,"Les services secrets américains demandent au pilote d'élite Mitchell Grant (Clint Eastwood), traumatisé par la guerre du Vietnam, de voler à l'URSS l'avion Firefox, invisible aux radars et dont l'armement est commandé par la pensée."
10729,fra,"Grimm, sa petite amie Phyllis et Loomis réussissent à cambrioler une banque sans trop de difficultés. Mais pour ce qui est de s'enfuir de New York afin de rejoindre l'aéroport, c'est un peu plus problématique..."
10730,fra,"Fred Wilson dirige une expédition destinée à trouver de nouveaux gisements de pétrole sur une île inconnue. Jack Prescott, jeune savant qui veut percer les mystères de l'île du Crane et Dwan, une cover-girl recueillie en mer, se joignent à la petite troupe."
10731,fra,"Mark Sway, jeune garçon de 11 ans, est témoin du suicide d'un procureur mafieux qui lui révèle avant certains détails gênants pour ses anciens patrons. Pour sauver sa vie, Mark feint l'ignorance mais l'ambitieux procureur Foltrigg le presse. Mark engage alors l'avocate Reggie Love pour le protéger à la fois de la mafia et de la justice..."
10732,fra,"Éloïse d'Artagnan, fille de l'illustre mousquetaire, est élevée dans un couvent. Le duc de Crassac, trafiquant d'esclaves et de café, envoie ses sbires, commandés par la « Femme en rouge », sa maîtresse, en expédition punitive dans l'établissement. La mère supérieure y laisse la vie. À la suite d'une confusion, Éloïse prend la route de Paris avec, dans sa poche, une liste de blanchisseries dont elle pense qu'elle dissimule, en langage codé, la clé d'un terrible complot. Chemin faisant, elle gagne l'amour d'un poète crotté, Quentin la Misère, et un poème que les agents de Mazarin saisissent et tentent de déchiffrer. Pendant ce temps, d'Artagnan retrouve sa fille avec des sentiments mitigés…"
10734,fra,"Frank Morris s'est évadé de plusieurs prisons. En 1960, il est écroué et transféré au célèbre pénitencier d'Alcatraz construit sur un piton rocheux face à la côte. Il réussira, une nouvelle fois avec deux complices, à s'évader de la prison la plus surveillée des États-Unis."
10750,fra,"A Baranquilla, en Colombie, des terroristes qui ont attaqué le palais de justice retiennent en otage le personnel et le président du tribunal. Leur chef, Luis Cali, veut obtenir la libération de son père, un important narco-trafiquant, et refuse de croire le juge qui lui affirme que celui-ci a été extradé aux États-Unis et se trouve en Floride. Lorsqu'il l'admet, il emmène le juge et le jette du haut de son hélicoptère. Peu de temps après, le fils d'une personnalité susceptible d'être enlevé par Cali est évacué par le FBI d'un collège américain fréquenté par des jeunes gens de bonne famille déjà exclus de nombre d'établissements ..."
10753,fra,"Chan Ka Kui, détective au sein de la police de Hong-Kong, vient de démanteler un cartel de la drogue. Au lieu de recevoir les honneurs, il est blâmé pour ses méthodes peu orthodoxes. Il est prêt à quitter la police, lorsqu'il se trouve accidentellement mêlé à un sombre chantage..."
10765,fra,"Les déboires sentimentaux d'une jeune veuve qui, pour oublier le décès tragique et brutal de son mari, s'engage dans l'armée."
10766,fra,"Après le décès de ses parents, Damien Thorn est élevé par son oncle Richard. Il intègre une école militaire avec son cousin Marc, mais de nouvelles morts étranges éveillent les soupçons de son oncle. Richard Thorn découvrira les circonstances de la mort de son frère et la véritable identité de son neveu, Damien, qui n’est autre que l’Antéchrist. En même temps, Damien le découvrira, et apprendra à contrôler le pouvoir du mal afin d’accomplir sa destinée."
10768,fra,Damien Thorn est maintenant âgé de 32 ans. Il est à la tête d’une grande multinationale. Il est aussi le leader d’une secte satanique qui le vénère en tant qu’Antéchrist mais le règne de Damien Thorn semble toucher à sa fin…
10771,fra,"Jimmy Tong travaille comme chauffeur de taxi dans la grande ville de New York. Un jour, il a pour passager le millionnaire Clark Devlin, également agent secret. Ce dernier engage Jimmy comme chauffeur personnel à une condition : que celui-ci ne touche jamais à son smoking."
10774,fra,"Au milieu des années 70, les informations à la télévision changent. Le journalisme perd en effet pied face au pouvoir de l'argent et le besoin croissant de divertissement. Une rédaction se bat alors pour maintenir son audience sans se compromettre."
10776,fra,"Dans le quartier le plus miteux de New York, Skid Row, se trouve une modeste boutique de fleurs. Les affaires vont mal et Mr. Mushnik, la mort dans l'âme, décide de fermer son magasin. C'est alors que Seymour, son employé, met en vitrine une fleur exotique achetée à un fleuriste chinois."
10780,fra,"Dean est un charpentier veuf menant une vie simple avec ses 4 enfants. À la demande de Joanna Stayton, une milliardaire capricieuse vivant sur un yacht, il construit un placard en chêne pour ses innombrables paires de chaussures. Mais la riche cliente refuse de le payer en prétextant que le placard aurait dû être fabriqué en cèdre, et l'envoie à l'eau avec ses outils. Lorsque Dean apprend plus tard que Joanna est elle-même tombée à l'eau en cherchant sa bague et est depuis lors tombée amnésique, il décide de se faire passer pour son mari et de la faire s'occuper de ses enfants pendant un mois en compensation de l'argent qu'il aurait dû toucher..."
10786,fra,"Après des années d'exil, Robin des Bois revient avec son fidèle ami Petit Jean à Sherwood. Dame Marianne est entrée au couvent, le Roi Richard et son frère Jean sont devenus fous, le temps de l'aventure semble définitivement terminé pour le valeureux cambrioleur. Mais le shérif de Nottingham revient troubler la paix de Sherwood. Afin de se battre contre l'opression et la terreur qu'inspire le shérif aux habitants, Robin rassemble ses vieux amis."
10792,fra,"François Perrin est ailier dans l'équipe réserve de la ville de Trincamp, où tout est football. Lors d'un entraînement il bouscule, de façon légale, Berthier, le joueur vedette du club, qui tombe. Bien que Berthier n'ait rien, cet incident vaut à Perrin l'exclusion d'abord de l'équipe, puis de l'usine, dont le patron Sivardière est aussi le président du club. Puis, essayant tant bien que mal de gagner sa vie par des petits boulots, il est viré du bistro «Le Pénalty», où il a ses habitudes, par le patron Berri, après avoir été provoqué par Berthier. Alors qu'il s'apprête à quitter la ville, il devient le pigeon idéal pour endosser un viol commis en réalité par Berthier. Victime d'un faux témoignage de deux membres du staff, Brochard et Lozeran, qui ont reconnu Berthier, François est alors mis en prison."
10798,fra,"Salon aéronautique de Farnborough, Angleterre. Alors qu'il était en pleine démonstration, un Mirage 2000 a disparu au-dessus de la Mer du Nord. Les capitaines Antoine Marchelli et Sébastien Vallois sont immédiatement envoyés en patrouille pour retrouver l'avion. Ils ne tardent pas à apercevoir le 2000 : il vole dissimulé sous un Airbus de Qatar Airways. Le pilote du Mirage les a repérés, il s'est placé en position de combat. Marchelli et Vallois reçoivent l'ordre d'abandonner la poursuite sans délai. Trop tard ! Le 2000 est sur le point d'abattre Vallois. Marchelli va devoir l'éliminer pour protéger son équipier. Cet incident est le prélude d'une gigantesque manipulation. À la clé, le détournement d'un avion de chasse français à des fins terroristes. Une manipulation dont le dernier acte se jouera un 14 juillet dans le ciel de Paris, au dessus des Champs-Élysées."
10802,fra,"Nomi, surgie de nulle part, arrive à Vegas pour réaliser son rêve : devenir danseuse. Modestement, elle débute dans une boite de strip‐tease. Elle est dotée d’un réel talent et ne souffre d’aucune pudeur. Elle se retrouve rapidement plongée au cœur des grands shows. Parviendra-t-elle à garder son âme ?"
10803,fra,"L’an 2274. En apparence, le Sanctuaire est un véritable paradis. Ses habitants, néanmoins, n’ont pas le droit d’en sortir. Ceux qui ont l’audace d’aller voir ailleurs sont systématiquement traqués et supprimés. De plus, une sorte de malédiction condamne la population à mourir à l’âge de 30 ans. Les citoyens qui atteignent cet âge sont éliminés au rayon laser. On parle d’une sélection qui permettrait à certains de renaître, mais nul n’est là pour en témoigner. Aussi les moins dociles préfèrent‐ils prendre la fuite avant le jour fatal. Logan est de ceux‐là. Cédant à la curiosité, il s’échappe un jour de la cité pour voir à quoi ressemble ce vaste monde qu’on lui cache depuis sa naissance…"
10806,fra,"Howard Brackett enseigne la littérature et la poésie anglaises au lycée de Greenleaf, une paisible bourgarde de l'Indiana où il a passé son enfance. Célibataire desinvolte, il est fiancé depuis trois ans à la timide Emily Montgomery, qui attend avec impatience leur mariage, comme sa mère. C'est alors qu'un de ces anciens élèves, devenu comédien, recoit un Oscar à Hollywood. Filmé par la télévision, il rend un hommage public à son ancien professeur et inspirateur, Howard Brackett... qui est gay."
10823,fra,"Burt et sa femme traversent les Etats-Unis en destination de Seattle, où Burt doit commencer à travailler dans un hôpital. Au Nebraska, ils se retrouvent dans une ferme où les enfants ont tué tous les adultes et vivent confinés, au sein d'une sorte de secte dédiée à une divinité mystérieuse, le Dieu du Maïs..."
10843,fra,"Un soir, dans un café de New York, Paul Hackett un modeste informaticien, fait la connaissance de la séduisante Marcy avec qui il sympathise. La jeune femme l'invite chez elle, mais tout ne va se passer comme prévu."
10849,fra,"Cecilia mène une existence morne et tourmentée. Le cinéma est son seul refuge et sa seule évasion. Lors d'une projection, Tom Baxter, le héros d'un mélo la Rose pourpre du Caire sort de l'écran et l'enlève."
10854,fra,"A la mort de leur père et mari, deux jeunes filles et leur mère héritent du seul bien familial : une vieille maison perchée dans les collines du fin fond de la Pennsylvanie. Cette demeure se situe près d'une mine abandonnée où, en 1913, des dizaines d'enfants ont péri dans un accident, victimes de la négligence du propriétaire. Une fois installée, alors que la plus jeune des filles déclare rencontrer chaque soir une certaine enfant nommée Mary, la mère fait la connaissance de Hanks, le voisin, un étrange personnage qui affirme que, toutes les nuits, les enfants reviennent à la vie pour se venger... et dévorer les vivants..."
10859,fra,"Après qu'un meutrier se soit évadé de prison, tout ses contacts à l'extérieur sont placés sous surveillance. Son ex-petite amie, Maria, se retrouve suivie par 4 policiers, dont Chris Leece qui va finir par succomber à ses charmes..."
10860,fra,"Dans une petite région de la Louisiane, six femmes d'âges et de caractères complètement différents, se retrouvent dans le salon de beauté de Truvy, entre les potins et les divers hauts et bas de la vie. Parmi elles il y a Claire et Ousier, amies et ennemies ; Annelle, naïve et religieuse, et Shelby qui, malgré une maladie, décide de devenir mère à tout prix. Lorsque Shelby meurt de diabète, les femmes se resserrent autour de M'Lynn, la mère de Shelby, au milieu des larmes et des rires ; elles créent une formidable solidarité féminine, comme des fleurs délicates mais faites d'acier qui ne se rompent pas face aux adversités de la vie."
10868,fra,"Un soir alors qu'elle s'est disputée avec son copain Larry, Sarah Tobias se rend dans un bar où elle a l'habitude d'aller. Sous l'emprise de la drogue, celle-ci agit de manière provocante auprès de la clientèle masculine. Un peu plus tard dans la soirée, elle est violée collectivement par une bande de trois hommes, devant une foule de spectateurs déchaînés. Kathryn Murphy est le procureur en charge de ce dossier. Elle souhaite vivement voir les responsables en prison, mais elle est progressivement freinée dans son désir de justice par le passé de Sarah, qui s'étale devant la cour et qui lui est particulièrement préjudiciable..."
10890,fra,"En l'espace d'une journée, John Winger perd son boulot, sa petite amie, son appartement et sa voiture. Avec un copain qui a autant de veine que lui, ils s'engagent dans l'armée. Parcours du combattant et marches forcées deviennent ainsi leurs occupations quotidiennes..."
10897,fra,"Le ""He-Man Womun Haters"" est un club formé par d'inséparables enfants. Rien ne pourra venir semer le trouble au sein de cette troupe pas comme les autres. Jusqu'au jour où l'un d'eux, Alfalfa, tombe sous le charme de la belle Darla..."
10911,fra,"Durant la Seconde Guerre mondiale, les allemands ont installé deux énormes canons sur l'île de Navarone, au large de la Turquie. Ces armes puissantes sont braquées sur l'île voisine de Kheros, rendant impossible l'évacuation des 2 000 soldats de la garnison britannique. Ces hommes assiégés se retrouvent dans une situation critique. L'état-major confie alors à un commando d'élite la délicate mission de détruire ces deux redoutables cerbères. Les 6 hommes, parmi lesquels un alpiniste et un spécialiste des explosifs, doivent, pour s'approcher de leur objectif, neutraliser la vedette de surveillance avant d'escalader la falaise qui protège les canons..."
10915,fra,"Le Major Cabot organise des agressions et en accuse les Indiens afin de leur voler leurs biens. Joe Mercy, vit de l'argent que lui rapporte sa participation à des duels spectaculaires. Avec l'aide de Locomotive et de Lucy, il décide de dérober à Cabot les 300 000 dollars que ce dernier doit remettre au Général Penbroke..."
10925,fra,"Deux employés d'un entrepôt de produits médicaux libèrent par inadvertance un gaz toxique ramenant un mort à la vie. Pour se débarrasser de ce cadavre réanimé, ils l'incinèrent. Malheureusement, le nuage de fumée crée une pluie étrange qui s'abat sur le cimetière voisin..."
10935,fra,"Deux anciens élèves de Harvard se retrouvent en 1890 dans le Wyoming. Averill est shérif fédéral tandis que Billy Irvine, rongé par l'alcool, est membre d'une association de gros éleveurs en lutte contre les petits immigrants venus pour la plupart d'Europe centrale. Averill s'oppose à l'intervention de l'association sur le district et tente de convaincre son amie Ella, une prostituée d'origine française, de quitter le pays."
10937,fra,"Évocation de la jeunesse et des premières amours tumultueuses du célèbre écrivain Charles Bukowski vue en partie par lui-même puisqu'il est le scénariste de ""Barfly"". ""Avec ""Barfly"", déclare Barbet Schroeder, j'ai voulu transposer à l'écran l'univers du poète. Il a écrit un scenario autobiographique sur l'amour de sa vie, le premier. L'image de marque du ""vieux dégueulasse"" va en prendre un sale coup et c'est tant mieux."""
10939,fra,"Trois mois après la fin de Le Grand Blond avec une chaussure noire, le capitaine Cambrai, qui enquête sur la mort étrange du colonel Milan, intercepte une lettre de François Perrin, qui file le grand amour avec Christine à Rio de Janeiro, dans laquelle il avoue à son ami Maurice la supercherie du colonel Toulouse. Ce dernier, mis en difficulté, doit désormais prouver que le grand blond est bien un super agent secret et non pas un inconnu choisi au hasard."
10945,fra,"Terry travaille dans une banque et communique par ordinateur avec ses clients à travers le monde. Un jour elle reçoit par hasard un message crypté, et se retrouve plongée dans une intrigue internationale…"
10957,fra,"Celui qui libère le pouvoir du mystérieux Chaudron Magique sera invincible. Le Seigneur des Ténèbres fera tout pour le posséder, mais il est mis à l'épreuve par un adversaire inattendu : un jeune éleveur de cochons nommé Taram, qui rêve de devenir un héros. Avec l'aide de la princesse Éloïse, du barde Ritournel et d'un cochon pouvant prédire l'avenir, Taram va essayer de vaincre le mal."
10974,fra,"Jackie, un grand aventurier, est désigné par Bannon, millionnaire collectionneur d'antiquités, pour retrouver les pièces manquantes d'un ancien artefact religieux, ""L'Armure de Dieu"". Parallèlement, les fidèles de cette religion veulent récupérer leur ""trésor"" et kidnappent la meilleure amie de Jackie, Lorelei, pour s'en servir comme monnaie d'échange."
10998,fra,"Les amours de passage d'un avocat new-yorkais, heureux mari et père de famille, avec une jeune éditrice célibataire, vont déclencher chez tous les protagonistes une avalanche de drames passionnels."
10999,fra,"Après avoir mené de nombreuses missions périlleuses, le colonel John Matrix, un ancien combattant d’élite, coule des jours heureux avec sa fille Jenny, âgée de 12 ans. Mais le général Arius, dictateur déchu, fait kidnapper celle‐ci et charge Matrix d’assassiner l’actuel Président du Val Verde. Ce qui n’est pas dans les plans de notre héros…"
11000,fra,"Armand dirige une boîte de travestis The Birdcage où Albert, son amant, est la star du spectacle. Quand Val, le fils d'Armand, annonce à ses parents qu'il se marie, Armand et Albert doivent se faire passer pour un couple hétérosexuel aux yeux de la belle-famille."
11002,fra,"Peu après sa naissance, un petit garçon dont les parents viennent de décéder est recueilli par une guenon en pleine jungle d'Afrique équatoriale."
